Doge, sell, trade, or hold? Serious inquiry.
The Athletic - crypto in sports business, NFT collectibles & NFT ticketing
Grammy Award winner The Weeknd announces plan for NFT drop this coming weekend
Here We Go Again: Musk Tweets SpaceX Is Going to 'Put Doge on the Moon'
Any suggestions for a volatile coin (on Coinbase)
What should Layer 1 of a blockchain architecture focus on?
Congratulations to Cardano as the Network Reaches 100% Decentralisation!
Crypto Ruined My Life
My favourite coin, Ignition coin just pumped 764% and is still going
A warning about the Altseason 2021 — Loft Financial
Neo launches N3 amid high Ethereum gas fees · TechNode
I tried to teach my kids a lesson in crypto and failed
TIL some sim-swap attacks are inside jobs, confirmed. This is why 1) You should NOT keep crypto on exchanges and 2) Use a Google authenticator app or AUTHY to store all 2FA information.
Hyperinflation in USA. Funny seeing people (especially Americans) almost joyous about prospect of hyperinflation, despite the fact it would literally wreck america’s way of life. Bitcoin may help, but its not going to prevent your life changing for the worse in my opinion
Atari bets on Bitcoin, NFTs and virtual casinos for its rebranding - Decentra.news - LAND , MANA, NFT's and cryptocurrency. Your #1 news source about everything Decentraland!
The future guaranteed x1000 token of April! You think it's a clickbait? Well, check this out:
"So being wrongly accused of a ""double spend"" leads directly to moon. Got it."
Bitcoin (BTC) Stalls Prior to Reclaiming $60,000 - (TA - 1st of April)
Are there gaps in your nonprofit org's IT? Upgrade your IT & we'll upgrade your headphones to Beats Solo3 - just by taking a demo (15-500 employee organizations). ✅ Lighting-Fast Support ✅ 70% Reduction in IT Spend ✅ Standardized Security ✅ Beats by Dre quality
This week has been great for EOS
I think its funny..
IRS KRAKEN Lawsuit To Get Crypto Account Holder Information
Jumping in head-first? Watch for the sharks ! Trading tips for beginners
Security Token Startup Polymath Founder Arrested on Sexual Assault Charges, Toronto Police Say
"Me buying bitcoin November 2017 ""I should have waited one week to catch the dip"""
Mom gave me money to start learning about crypto currency while earning money
Mike Novogratz: 'Inevitable' for Bitcoin To Have a Higher Market Cap Than Gold
FINALLY - Beautiful Coinbase UX coming to Coinbase Pro! 🌸
Congratulations on surviving March which is notoriously Bearish - Now we hit April which is notoriously Bullish. 📈🍗🙏
What Crypto currency platforms to use?
Today I remembered that Coinbase Pro and Coinbase are separate accounts
Voyager application (broker)
$SQRT - SQRTL Finance < Be early, unique coin, save the turtles (312,600 MC at time of post)
HYBRIX ($HY) An absolute MoonShot and a half. A working product that solves a huge headache in crypto and only a handful of big Crypto Twitter folks have noticed it...
ZilPN project on Zilliqa trying to create safer networks; DPN, the next step in decentralized web privacy.
OPPORTUNITY TO JOIN! MEMES Token - The coin of MEMES !
TCPFM - 1Mill Marketcap reached with 800 holders - organic growth - BSC/Pancakeswap
Track real-time Link price, monitor all Chainlink news on the web and get web push notifications on Coinbench
Vira-lata Finance ($REAU): future stablecoin of Brazil
Get The Most Advanced Charting Software For Crypto FREE Only For Today. Create custom workspaces, and chart across over 75 exchanges.
R3FI Brings Frictionless Yield Farming Across Chains!
Hope you all bought $NAUT a week ago when I told you about it! It's not even close to too late to get in, and it's actually not a dumb meme coin for once.
YEEZY | 🌊 Welcome To KanyeCoin 🌊 THIS TIME YOU ARE EARLY... As fuuuuuuuuck! Come on in! Louched 30 minutes ago...
AUDITED BY HALBORN - WolfyStreetBets ($WOLFY) - Prediction Platform - DeFi Pulse (DeFi) vs S&P500 (CeFi) - 7m Market Cap
MoonLander the MoonShot - $60k MCAP - 3 days in already 400+ holder
SPACEMONKEY (SPMK) 1.5 hour old
Presale Live - Calling All Martians 👽
Stake your NFTs and earn tokens - $OAK
SpaceXElon. Not released yet!
VIDYA
Bingus Token - A New Kitty has arrived. (I thought this would be a quick flip, I was wrong)
AXXA (XXAI) use case, low mc & 24hrs old
MobiePay ($MBX) – A Sleeping Giant Awakens
TCPFM - to the moon as a community - steady growth - BSC/Pancakeswap
Do you like Fishsticks? Buy some Gayfish. Just released last night. 30k marketcap.
TomToken Just Lauched!!
$PIT's $20K Donation fee is officially raised for the WhiteBit listing!
TomToken - New innovative Token with a game
OGN/USDT good buy, little dip so good to enter now
Aqualair’s Features Passive Earners Should Know About
"3 ""Animal Coins"" that can come out winners in April? - Making Crypto Easy"
Accepting crypto as payments at my shop.
Aaron Feickert, the person that will take Monero to the moon.
Is crypto currency?
Bakkt Holdings Launching Digital Wallet App
I made a Free software that automatically alerts you of the best crypto currencies to buy!
Why You Need A Good Crypto Writer For Your Project
Do you want to win 5 DOLLARS FOR FREE? You only need to register in this new game (do it before APRIL ends)
BNB Capital Update! $219 Passive Income A Day!
HTML
There is such thing as a good shitcoin?
SupremeBSC - yield token with hypebeast inspired NFTs
https://youtu.be/RU4aHnZlHhM
Tron's TRX price went parabolic today
Rank 11 of all DEX today - https://dappradar.com/rankings/category/exchanges
Unpopular opinion: The current relation between crypto miner and gamers could be the demise of cryptocurrencies
Looking for diversity
Ethereum: The Programmable Blockchain Changing the World
Tell your story about a scam coin
Klaytn Klay in the Top 13 Crypto Market - Project Review (In Depth)
Something BIG Again To Tune In On KuCoin?
Madfish Launches QuipuSwap, the First Decentralized Exchange in Tezos Ecosystem
Follow Reddcoinnews on Instagam and win your first 1500 $RDD at 1500 followers 🚀🚀🚀
Harmony One is about to 🌝 again
Bitcoin and some altcoins will soon be available to Goldman Sachs clients.
How does the MACD indicator work? A look at $DOT - Making Crypto Easy
Bakkt Launches Bitcoin Wallet With Starbucks And More
Oasis Network ($ROSE) is going to the moon in 2021. FIND OUT WHY!
I recently shared with you a bot I coded that buys Bitcoin when Elon Musk tweets about it, and your response got it featured on Decrypt. You guys made me want to release an official application for it
‘One Bitcoin per Lambo, then one Bitcoin per Bugatti’, says Kraken boss as he tips Polkadot to be next Ethereum
Cointelegraph remarks last recent OGN's steps becoming a leader in NFTs & DeFi
What to do with/for my savings
This subreddit is now an NSA fanclub
Ring-LWE over two-to-power cyclotomics is not hard
Inversing Modular Exponentiation
What's the best crypto settings for GPG?
NIST LWC finalists announced
Idea for testing cipher
Why is Sha-256 useful for certificates and file verification. Couldn't hackers intercept the hash too?
Calculating decryption key if RSA was based on prime p
Book recommendations - mathematical cryptography for cryptocurrencies and blockchains
Fetu Public Key Distrubution - Hardness Evaluation
Symmetric encryption of large file, API decision
The Solution of the Zodiac Killer’s 340-Character Cipher
Recovering a full PEM Private Key when half of it is redacted
How to implement Chosen Prefix Collison attack
Create your crypto homepage on Coinbench.com: Read news, track your portfolio, get push notifications on new updates
SHA-3 in R
Edward Snowden has a keynote speech today at the Priv8 Conference!
Simultaneous compression+encryption with tANS e.g. for remote sensors, Zstandard in Linux kernel?
certificate transparency log
Why is salting useful, if the salt is stored along with the account name?
Password Storage - OWASP Cheat Sheet Series
Why is twin ElGamal CCA secure under CDH assumption?
[OC] Ncurses TCP Chat with encryption end to end C++
"""ssh-ed25519 255"" vs ""ssh-ed25519 256"""
Career/college path
How secure is it to take an arbitrary 256 bytes secret key for a schnorr like identification protocol ?
Any standard for a digital communication security protocol which does not use any asymmetric primitives but 'modern' security?
A Multiplatform Parallel Approach for Lattice Sieving Algorithms
The Sumcheck Protocol: Backbone of Modern Day zkSNARKs
Is there a wiki?
How does PGP work compared to BTC sig address?
Let's talk about borders (and crossing them)
Let's talk about Session.
Why Session can't be trusted
ChaCha20 Encryption Performance on DEC PDP-11
Why polynomial modular arithmetic in Finite Fields?
ChaseApp - One Search. Any App.
Signal protocol security of messages
Understanding Extended-Nonce Constructions (by studying XChaCha)
Arbitrary-length key derivation with libsodium
[meetup] Understanding the TFHE homomorphic encryption scheme
How do zk-SNArKs work?
new in developing, where to start?
Intel to Build Silicon for Fully Homomorphic Encryption: This is Important
Understanding the impact of partitioning oracle attacks on production deployments of ChaCha/Salsa
Lord of the Ring(s): Side Channel Attacks on the CPU On-Chip Ring Interconnect Are Practical
No-Knowledge Proofs: A useless cryptographic diversion
Asymmetric cryptosystem proposal.
Help me break this!
Where to host veracrypt containers in the cloud for backup?
"Is there a non-pairings-based and/or practical implementation for IBE or ""delegatable decryption""?"
"""One-Time Verifiably Encrypted Signatures"" about to get merged into secp256k1-zkp"
Is an AES key just a number?
Experiences with Bruce Schneier's self study course in block cipher cryptanalysis?
How will Quantum computing affect Cryptography?
Compression of curve25519 public key points
Fast Factoring Integers by SVP Algorithms (Claus Peter Schnorr) - “This destroyes the RSA cryptosystem.”
Implementation of Coppersmith attack (RSA attack using lattice reductions)
"Ruffing: From the abstract on ePrint (not in the paper): ""This destroyes [sic] the RSA cryptosystem."""
Proofs, Arguments, and Zero-Knowledge [PDF book about zero-knowledge proof construction]
Hi, I made this simple encryption algorithm that uses hashing and a sort of Caesar Cipher. What are it's weaknesses?
Looking for a breakdown of jobs involving cryptanalysis
Privacy Preserving Machine Learning for Healthcare using CrypTFlow
The X.509 elephant in the certificate room: Do other certificate standards even exist?
Crypto experts.... your country needs YOU
Rogaway abandoned patents on OCB3
So is this smart?
Is there a directory for decentralised applications?
Bulletproof TLS Newsletter Issue #74
Limitations of hashcat type approach to cracking
congregation library for relational MPC
Roadmap for Learning Beyond the Basics from a Practical Side
Are there any more assymetric key algorithms?
Kotlin Multiplatform Libsodium wrapper library
Adventures with RSA Blind Signing
Cryptography Book Suggestions?
Algorithms to generate one-use promotion codes?
Identify columnar transposition cipher when you know the plaintext input?
Cryptography Interface Design is a Security Concern
Honey Encryption for BIP39 Cryptocurrency Seeds
J.-P. Aumasson: Should Curve25519 keys be validated? (2017)
ECDHE over Edwards25519
Argon2id question - how does it split between argon2d and argon2i
"Is RFC3394 still the best approach for implementing ""envelope"" encryption in 2021?"
Engineer apprentice and the OpenSSL Cthulhu
"Are ChaCha and Salsa20 considered ""deterministic"""
What are some possible jobs for Cryptographers?
Look-up tables for bcrypt, scrypt and Argon2?
I implemented FrodoKEM in Golang: a Practical quantum-secure key encapsulation
Zero-knowledge proofs and an implementation bug
How difficult is a cryptography masters with not much programming background?
SPARKNaCl performance versus TweetNaCl
How do I generate truly random numbers on windows?
What are some commonly used crypto standards today?
Strictly context-binding signatures
When a KEM is not enough
"Is there any way of having a ""temporary"" decoding key?"
Best way to encrypt a file with GPG
KangarooTwelve: Is Hash-then-MAC really necessary?
Mining Bitcoin with pencil and paper - SHA-256 algorithm (2014)
How does Tiger Hash work? What happens in the inner rounds and outer rounds?
One time pad: Using cribdrag to decrypt ciphers and/or get the key
What are the math prerequisites for Cryptography?
Resources to learn cryptography
Coursera week 4 - CBC padding oracle help
Basilisk Collection - An Hard Sci-Fi Story About Doubled SHA-256
Chaos Runes: a set of tiles to generate high entropy passwords
Do Veracrypt containers compress well?
How dangerous is setting the nonce to be the hash of the message for libsodium's secretbox?
Optimized fastgcd has been machine-verified (Peter Wuille on Twitter)
Universal Composability Internship
Need help decoding JWE (JSON Web Encryption) in PHP
Daily General Discussion and spitballin thread - April 01, 2021
Daily Advice Thread - All basic help or advice questions must be posted here.
Biden’s $2.3 Trillion Infrastructure Plan Takes Broad Aim
Microsoft wins U.S. Army contract for augmented-reality headsets, worth up to $21.9 billion over 10 years
Quantifying Beta Slippage (Why Leveraged ETFs are Not as Scary as You Might Think)
ZDGE - 80% revenue growth at a 45 PE ratio offers 90% upside (DD)
MKTY, the undiscovered biggest competitor of Riot and Mara
Goldman Sachs is close to offering bitcoin and other digital assets to its wealth management clients
My take on Gold's longterm outlook
Daily General Discussion and spitballin thread - March 31, 2021
Affrontez le monde viking de Kaldheim. Découvrez l'extension sur MTG Arena.
FTC files suit against Illumina (ILMN) to block vertical integration with Grail
How an energy firm tied to billionaire Warren Buffett plans to save the Texas electric grid
Might be a good time to short the Japanese stock market. It isn’t news yet, but another state of emergency looks likely in April
Don't Confuse Archegos Collapse With Contagio - By Aaron Brown
PayPal to allow Americans to pay with Bitcoin, Ethereum at millions of vendors
Klarna - possible 2022 IPO
ARK Space Exploration ETF (ARKX) - Holdings Reveal
Daily General Discussion and spitballin thread - March 30, 2021
Buying S&P 500 options based on these indicators made +141% in 5 weeks
Catalysts for novavax stock price
India-based plays, 3 ideas, thoughts?
Negative numbers in financial statements.
Stock Scraper Trending Data as of 03/29/21
ARKX top holdings by weight
Ahchegos Capital Management
Il n'est pas trop tard pour repousser les limites de l'humanité. Découvre le centre Bright Dimension où les non-gamers peuvent développer leurs aptitudes😉 #Windows10
Activision Blizzard DD: Short Analysis
Largest venture rounds in AQSE?
Daily General Discussion and spitballin thread - March 29, 2021
BREAKING: NeuroRX (BRPA) Announces Successful Phase 3 COVID Drug Trial Results
Failure of the fund to meet margin commitments, Credit Suisse and a number of other banks are in the process of exiting positions
Finding financial numbers by country or geographic location.
Large fire at Indonesia's Balongan oil refinery in West Java
Thinking about getting out of BND and picking up series I bonds.
Investing in Helium - DMEHF DD
ARK is amending prospectus language for its ETFs
Coursera: A DD Introduction
Bubble Deniers Abound to Dismiss Valuation Metrics One by One
Daily General Discussion and spitballin thread - March 28, 2021
Palantir Technologies (PLTR) DD
Still tracking your investment portfolio in a spreadsheet? Don't waste time manually adding all those holdings, trades, & dividends. Sign up to Sharesight FREE and use the web's award-winning portfolio tracker today.
Highly Leveraged Hedge Fund Rumored to Have Imploded: Some Stocks Remain Heavily Discounted
Bonds vs Stocks and Short Term Returns: Now is not the Time to Panic
[$BB] The size of the real-world driving datasets that Blackberry IVY has access to will be so much bigger than Tesla's
Wework announces merger with BowX to go public
Ben Felix Proposed Five-Factor ETF Model Portofolio
Plugging In: The EV Transition Gains Speed
DD on digital health company OptimizeRx (OPRX)
Daily General Discussion and spitballin thread - March 27, 2021
Ending China Stimulus / SEC Law Enacted Provide Unique Buying Opportunity For Chinese Companies (High Risk, High Reward)
Canadian Index ETFs XIU - XIC - VCN - ZCN comparison
Extreme Diversification Portfolio
VIAC oversold. Comparison inside.
SoFi to give amateur investors early access to IPOs
Daily General Discussion and spitballin thread - March 26, 2021
Fed says banks will have to wait until June 30 to start issuing buybacks and bigger dividends
Track your investment portfolio online automatically with Sharesight. Don't waste time manually adding your holdings, trades & dividends into a spreadsheet - sign up FREE and use the award-winning portfolio tracker today.
U.S. weekly jobless claims hit one-year low in boost to economic outlook
SEC filing points to Fidelity on creating a bitcoin ETF
The End of Tesla's Dominance May Be Closer Than It Appears
Daily General Discussion and spitballin thread - March 25, 2021
S&P 500 vs MSCI world index
I love Jefferies - the company, the CEO, the stock (JEF)
The SEC confirms it is investigating SoftBank for market manipulation. Softbank spent $17B worth of shares in the US tech market, with another $3.4B in bets to prop up their prices.
Preferred shares ETF in Canada a quick comparison
$PRQR ProQR Announces Positive Results from Clinical Trial of QR-421a in Usher Syndrome and Plans to Start Pivotal Trials
A Diamond in the Rough: $DFNS - A Sub-NAV SPAC with a Definitive Merger Agreement
Fluent (FLNT) - Highly volatile + Market Psychology play
Daily General Discussion and spitballin thread - March 24, 2021
Best stocks for the fourth industrial revolution
Leveraged ETF - Projected Returns of Funds for Intra-Day Purchases - How does the math work?
It appears the recent move in the US 10-year Treasury yield from 1.2% to 1.7% had very little to do with inflation expectations.
Intel is spending $20 billion to build two new chip plants in Arizona
Dip buyers: It's a good time to get into small caps
Robinhood Is Said to Have Filed Confidentially for U.S. IPO
Boston Federal Reserve, MIT to release digital dollar prototypes as soon as July
Microsoft ($MSFT) DD - Sitting on a gold mine
DD - TKAT and OCG are scams should be worth nothing
CRSR DD - A Compelling Growth Story
Daily General Discussion and spitballin thread - March 23, 2021
ViacomCBS announces share offer worth 3 Billion dollar
Some DD on Lockheed Martin LMT, or, how to play America, defense, space and the same time.
Interesting facts about brokerage insurance
NIO, XPEV, and Li Auto Reportedly Planning Hong Kong Listing
Alternative Investments: African Agricultural Crowd Investment Platforms - Experiences?
Ionis Pharmaceuticals Drops After Huntington's Disease Phase III Trial Partnership with Roche is Halted
iShares Global Timber & Forestry ETF (WOOD) DD - Bullish Case For Continued Lumber Prices & 2021 Outlook
JP MORGAN May Soon Turn Away Deposits from Institutions
Daily General Discussion and spitballin thread - March 22, 2021
Analysis of IWDA and VTI investment using DCA over 5 year period
$BNGO Bionano Genomics DD – The future of genomics is here. Why I am 100% bullish. HUGE Upside potential
"Personal investor ""Valuation"" vs. Index funds"
Major railroad merger! Canadian Pacific is buying Kansas City Southern in a ~$25B deal - ~22% premium to Friday's close
Daily General Discussion and spitballin thread - March 21, 2021
Dust Attack?
Tu n’es pas gamer et tu n’as que peu de chances de réussir dans la société moderne ? Ne cherche plus ! Le centre Bright Dimensions va te permettre d'acquérir les compétences nécessaires pour contribuer davantage à la société 😉 #Windows10
TREND LINES
Did I get free BNB on Binance??
The end is near
Does anyone have any experience with slow bank transfers?
DREP coin
P2P market
Trading BETH/ETH time
Unauthorized actions on my account. $20k+ loss in less than 4min.
Account binance stolen and ticket not answered disappeared
is binance remove paypal from their p2p zone?
Withdrawals blocked without notice
Binance ist NOT Binance.us . So stop posting in Binance
I don't receive yield rewards from liquidity pool
Binance VIP levels
Face verification - FAILURE - received an answer at first, but then no help. Wrote an email and the only advice I got, was to contact the support. Can someone help?
ETH lost
I am getting nowhere with binance.us and they have my trading disabled with no help from support.
Does binance pay charge a transaction fee?
I need help please!! Lost funds
What is the official Documentation for the binance API?
Printing a Statement
Selling BTC, and withdrawing to Payoneer
Binance API not offering access to Binance Earn balance?
Problem accessing conversion history on Binance.com
Imagine un monde dans lequel les nombreuses aptitudes des gamers seraient recherchées… et partagées avec le plus grand nombre pour repousser les limites de l'humanité par le gaming. #Windows10
Binance hasn’t responded to any of my tickets for over a months !!
Binance rejects retrieval form incorrectly - $15k lost
Account has been temporarily disabled
Bitcoin closed its 6th green monthly candle in a row
Please help, about credit card fraud
Cant trade or convert my DERP token...
DODO price prediction ?
Please help
Connect 2 phone
ETH 2.0 stake...BETH trading at 0.95. so I lost 5% already?
Trade for .005 BSC/Binance Smart Chain?
Binance.us ADA (Cardano) withdrawals are back online. Per my ticket# 604172, you can now withdrawal your ADA from Binance.us as of 3/31/31 10pm PDT.
Lost Crypto withdrew from Binance using ERC 20. HELP!
ACH Deposit Failure - Your bank information has changed
Binance Launchpad BNB calculation?
How do I get my money out of Binance and into Binance.US?
Wallet Recovery Form
Max Leverage Question
Not able to transfer wallets
Bank Deposits
I am 26 years old, I am looking for a helping hand🙏🙏
Block Canadians to exchange
Querying BSC and sorting contracts by total holders
Thread 'Updates to the DREP (DREP) 100:1 Redenomination Plan'
Spark Flare token Claim on binance.us
How’s everyone in the Binance world today?
Zero maker fee on spot EUR even in April?
Binance Hive OS SETUP
How to transfer coins from Binance to Coinbase?
Binance.US locked my Account
Market orders for SL/TP for spot
Case ID #5161299
"I accidently click ""Reeden earlier"" right after I purchase on locked staking. And now I need to wait 3 days.."
Looking for ideas/suggestions with a Binance.us issue
BUSD Savings
Why am i unable to withdraw my XLM ? withdrawal suspended?
How and when will the tournament winnings be paid?
How is it possible
Staking question
What is stopping Binance smart chain from taking over eth?
Binance’s AUS CEO: “If you guys want it faster, just make more noise on Twitter” —— take his advise everyone with your customer service complaints & support requests!
UserDataStreams not working for futures?
Bnb token keeps losing tiny amounts
My trading is disabled and no one is helping me at Binance US, been over a month.
Any explanation as why am still showing 0BNB
Can someone from Binance team explain why I can’t withdraw my Harmony ONE coin. It’s been one week trying.
VTHOR?
Escalate support ticket #5115637
Who is loosing money in launchpad ?
i lost my token when deposit into binance
Binance API: How can I fetch the account's balance in EUR, USD, etc. (NOT BTC, ETH, etc)?
"Approaching 30 days with no resolution - Over 10 days since being ""Priority Transfer to a Senior Agent"" with no contact. Withdrawals suspended."
BNB Set To SkyRocket Due To Binance Smart Chain Overtaking ETH!
Price marks and order book is not working
Binance.US - ADA - “Withdrawal for this coin is turn off”
Gris trading is telling me I have open positions and/or open orders, please help!!
Binance credit card and bnb
Newbie Canadian looking to withdraw DOGE
How do i see what i payed for my crypto in 2017
I have a BNB problem and need help!
NEED HELP with Retrieval of funds now worth 7000dollars
Why should I stay at Binance if I can't trade a lot of Altcoins?
money not in my bank after saying it was successful
DREP plunges from above 3$ to 0.2 cents after coin burn!!!
GBP withdrawal
pyxis (pyx) proposition
Remove Debit Card from Binance
You can buy BNB with 300+ cryptocurrencies on SimpleSwap – instant crypto exchange without sign up and limits!
Partly Disappointed supporter of Swipe SXP (Binance owned)
Smallest market cap coins
Liquid Swap needs API or CSV export
Can't Withdraw Funds
SEPA withdrawals problems!
Checkout RLY ahead of its ICO
To all Cardano holders, learn how to stake OUTSIDE exchanges
BSCscan -analytics - fees
Cleaning up Dust on Binance US
Can I withdraw a loan I am not KYC yet ! I am waiting for my passport... It appears to be offering me a loan... but how do I get it from Binance to my pocket to spend it ?
I need twitter handles of key people at Binance.
Algotrading bug - Does this make sense to anyone ?
Question: Based on what im looking at is the binance launchpad risk free
CASH DEPOSITS! need info
My $1000 Beginners Crypto Portfolio - Which Altcoins I'm Buying (April 2021)
Account help
Binance got hacked, any idea how to get it back?
Binance /Trust Wallet
