Instadapp Launches Governance Token," Introduces ""DeFi Smart Layer"" | Crypto Briefing"
Coinbase would now be the 17th largest bank in the United States, with $223 billion in assets.
I am currently in my late twenties and over half of my net worth is now in crypto.
Billionaire Mark Cuban Reveals Why He Thinks Ethereum Will ‘Dwarf’ Bitcoin As Crypto Market Price Hits $2 Trillion
New to the crypto world.
I'd like to use Wirex's card as my current account but the exchange rates they offer are embarrassing
Coinbase is the absolute pinnacle of incompetence
Unpopular Opinion: Fear around moon visibility is a severe overreaction
Missouri Man Bags 12-Year Jail Term for Trying to Buy Chemical Weapon With Bitcoin
Gameuses, gameurs, le monde à besoin de vous pour repousser les limites de l'humanité par le gaming 😉 #Windows10
If we decide to be able to hide our Moon counter we should also de-identify the distribution proposal each month
Ripple Wins Discovery: Judge Grants Access to SEC Internal Records on Bitcoin, Ether, XRP
Looking for advice for making coin for school
About 80K bitcoin leaves exchange site. Bull signal?
Feeling sorry about not buying something in retrospect
SEC filings: Morgan Stanley's wealthy clients invest $230m into Galaxy bitcoin funds
PC gamer OMEN 30L. Repousse les limites de l'humanité par le gaming. #Windows10
Does anyone want to leave a coin subreddit when that coin starts mooning or becoming popular?
Win up to 100 Moons in the first ever Online Moon Duck Race - Starts 1pm GMT
Crypto Comparison Website
Bitcoin Mining Could Use More Energy Than All of Italy by 2024
Anyone else feel relieved with their longterm life now?
12 Crypto Firms That Are Hiring Right now - April 2021 Edition | CoinMarketCap
How I (mostly) stopped trading and always swapping out coins
How to stay up to date with information?
This sub is all about decentralisation.. But maybe centralised crypto is needed for survival?
Too hesitant to get into crypto? This is made for you by a newb.
Crypto ban
BANCOR (BNT), is it a good project?
A Potential Bitcoin Price Explosion Above $60,0000 Is Brewing; Here’s Why
BlockFi under the loop
The Different Types Of Ethereum Tokens - ERC-20, ERC-223, ERC-721, ERC-777 Comparison
I feel overwhelmed with all these projects. I did myself a favour and dumped the majority of my altcoins.
Spending much less money after getting into crypto
Bloomberg - Coinbase’s Nasdaq Listing Fuels Frenzy in Korean Crypto Stocks
Playboy Is Turning Its Classic Centerfolds Into NFTs
Aeternalism may be the next coin to 100x
I just wanted a sister. - Nebula
Get your $CUMMIES! (CumRocket) The itunes/onlyfans equivalent of NFTs
$HOGL - Deflationary Moonshot on Binance Smart Chain - Confirmed WhiteBit Listing Tomorrow - The Time is Now
If you own a mouse, you have to play this game. No Install.
CURIO INVEST - $CUR – $3 million cap swiss crypto startup tokenizing real world assets
VAULT, the Community Bank. Still only 1m Market Cap.
Do you love DOOM? Well how about a vidyacoin gem in the sea of elonX/safeX/dogtoken shitcoins. Get some $DOOM from doomguy.finance and join our soon to be created DOOM server while watching your gains grow.
Aiming for a fast expansion to 10X($DKB) Donkey Kong's Bananas (STRETCH GOAL 50X)
$pajeet coin, a hilarious coin with mission to remove the stigma and help underprivileged indian society
My Top 6 Altcoins for the Altcoin Season / Supercycle 2021
Moon Rave - Community Owned (for real)
"""There's no way anime", harem, comedy," and rpg would make a great tale. Be original already."" Sir/Maam", have you read the Anime Trope System series?
$FOX - The token powering ShapeShift's new platform. A functional token from a big name that Reddit hasn't discovered yet.
$DaBaby v2 is now live on BSC. Low market cap. Anti whale tokenomics. This will blow up !
🍀 [ FRX ] Ferox Token 🍀 Rising Star of Tron Network, Tremendous Opportunity on Seed Round
$POODL The Community Token Up 150% Today!
Burger King Coin BABY!
Ride The Moon Now
Strong reversal. WenMoon has been looking primed all day and is starting to go
Missed ElonGate? There's a sequel
New DeFi giant coming in May? Crypto project worth of our attention in coming month.
Looking for the next moon ? #CyberMoon is here - PRESALE
$Obama SECOND WAVE 👨‍🚀🚀👨‍🚀🚀
Do you know what DOOM is? DOOMGUY.FINANCE $DOOM Is gonna make you reminisce, laugh, and probably make you 100x
PENNY Token is brand new, super active, and could go to a penny some day
DavePortnoy.Charity $DPC Meme Coin Just Launched
Audius 2,119% GAIN realised ($0.226 entry and $4.79 exit), first posted about when at 22 cents on Feb. 3rd in Diamondhedge and SSB subs.
$Mystery (MST) - ARG Based Deflationary Token is about to list in two hours (Presale almost over)
Cryptocurrency Inflows At All-Time High In First-Quarter Reaching $4.5 Billion
Dogira X Whitebit AMA!
Introducing Holder Finance: The Platform Offering the Best Store of Value Token
Ethereum Scalability Project MetisDAO Launches Public Alpha Testnet
citizens can now shop at Amazon, Walmart, and eBay using eGold via Shopping.io. However, eGold will integrate Shopping.io on April 8.
Bitcoin Gold
KCS now back in Top 100!
Will China’s rising crypto crimes prompt tighter regulation?
Bullish Siacoin price prediction ranges from $0.032 to $0.068. Siacoin price might also reach $0.5 soon. Siacoin bearish market price prediction for 2021 is $0.0074.
Looking for new things to learn!
Buying pundix
Zenon $ZNN - Network of Momentum 8.6M max supply 130M Mcap - 55% APY staking
need reviews on incognito.org
Cryptocurrency prices soaring, the entire market’s value over $2 trillion for the first time. The Bitcoin price is hovering around $60,000 per Bitcoin. The rally is driven by Ethereum and Binance coin has surged over the last year. This happens due to a burst of interest in so-called decentralize
Cardano’s cFund, Picks COTI for Its First VC Investment
cFund, the Cardano ecosystem venture fund, announces its first VC investment in COTI
Best ICO in 2021?
#HBAR
A decentralized conglomerate of states - reddit pitch
XRP Bull
The Regulatory Shift
In what crypto to invest in?
BNB withdrawal suspended
Bitcoin vs Gold: Which Is a Better Investment now?
Send ethereum from binance to trust wallet wrong
Defit token hits Uniswap tomorrow
Deeper Network (DPR) announced their listing on UniSwap on April 10. DPR provides true Internet solutions, freedom, and enhanced security. Smart contracts security of DPR has been successfully audited by Slowmist.
KIWIE Set to Launch NFTs Representing Real-Life Street Art in 1001 Locations Across The World
What coins do you think got the most potential in the future?
Conflux CFX at CMC market cap rank #98!
All-In-One Crypto Trading Platform Atani Adds $6.25M In Seed Capital
iNFT = NFT + AI
NFT picks?
MicroStrategy adds to its portfolio another $15 million in Bitcoin - Crypto DeFinance
Exploring NFT Art On Tezos (Part 2) – Daniel Cassell, AKA Neurosis
Litecoin and XRP
What happens to the moons/upvotes when a post gets deleted?
I don't want to get rich - I just want a peaceful life
Two Coinbase employees get married on ETH blockchain. Peter composed an ETH smart contract named Tabaat. It takes around $537 to tokenize a marriage contract. The ceremony took 4 minutes to be verified by the ETH network.
Cook Protocol Announces Staking Program “Voyage to the New World”
Certificates Confuse Everything -- if you think you need a X.509 certificate, you almost certainly don't
Homomorphic Encryption April 6th, at 7 PM (PDT)
Provably secure ciphers
Educational Resources
Naked public keys over TLS?
Anonymous Credentials [State-of-the-art]
[OC] [Code Art] I created HashMaster and Reverse HashMaster
any symmetric crypt function that doesn't error out on failed decrypt?
Is compression still important for file encryption?
Post Quantum Finalist Comparisons
Lots of new information/announcements on the IACR (Infernal Alliance for Craptologic Research) webpage
OneDrive or Bitwarden for secure documents
Preventing MITM between two microcontrollers
What's the best crypto settings for GPG?
Why is Sha-256 useful for certificates and file verification. Couldn't hackers intercept the hash too?
Book recommendations - mathematical cryptography for cryptocurrencies and blockchains
Fetu Public Key Distrubution - Hardness Evaluation
Symmetric encryption of large file, API decision
How to implement Chosen Prefix Collison attack
Develop your cities on other planet, Warming it, creating oceans and spread life 🌎
Password Storage - OWASP Cheat Sheet Series
Career/college path
Any standard for a digital communication security protocol which does not use any asymmetric primitives but 'modern' security?
How does PGP work compared to BTC sig address?
Dropbox Vault, how secure is it?
Bitlocker with Plausible Deniability
ChaseApp - One Search. Any App.
How do zk-SNArKs work?
Intel to Build Silicon for Fully Homomorphic Encryption: This is Important
Why do Zoom's password hashes collide and should you be worried about it?
Asymmetric cryptosystem proposal.
I found a private key on my house.
Puppy (or Jedi) in training? Keep your galaxy clean with a washable rug from Ruggable.
Is an AES key just a number?
Compression of curve25519 public key points
Implementation of Coppersmith attack (RSA attack using lattice reductions)
Looking for a breakdown of jobs involving cryptanalysis
Privacy Preserving Machine Learning for Healthcare using CrypTFlow
So is this smart?
congregation library for relational MPC
Adventures with RSA Blind Signing
Algorithms to generate one-use promotion codes?
Cryptography Interface Design is a Security Concern
J.-P. Aumasson: Should Curve25519 keys be validated? (2017)
Are you a Software Engineer living outside the U.S.? Interested in top remote U.S. Software jobs? U.S Software Developers Jobs. Work Remotely. No Visa needed. Full time jobs. High salary.
ECDHE over Edwards25519
"Is RFC3394 still the best approach for implementing ""envelope"" encryption in 2021?"
"Are ChaCha and Salsa20 considered ""deterministic"""
Look-up tables for bcrypt, scrypt and Argon2?
Daily General Discussion and spitballin thread - April 07, 2021
I just posted 2 years of minute-by-minute intraday S&P 500, VIX, & US large cap data on Kaggle
Coinbase Announces First Quarter 2021 Estimated Results
Tu n’es pas gamer et tu n’as que peu de chances de réussir dans la société moderne ? Ne cherche plus ! Le centre Bright Dimensions va te permettre d'acquérir les compétences nécessaires pour contribuer davantage à la société 😉 #Windows10
ChargePoint Alternative Play
Performance of Small and Big Companies Sorted by Operating Profitability and Book to Market since 1963 US
Affrontez le monde viking de Kaldheim. Découvrez l'extension sur MTG Arena.
After record selling spree, Japan's top insurers weigh buying U.S. bonds again
Arcimoto ($FUV) valuation compared to other EV companies
$EMPW(HLLY) a overlooked and misunderstood stimulus play
Daily General Discussion and spitballin thread - April 05, 2021
Buying S&P 500 options based on these indicators made +141% in 5 weeks
Energy Transfer ($ET) DD from discord that I wrote.
Daily General Discussion and spitballin thread - April 04, 2021
High Yield when they are Low Yield
Lumber Prices are Up 250% in the last 3 months
Daily General Discussion and spitballin thread - April 03, 2021
Drd gold , a vertical growth gold mine
Why are fossil fuel investors in the green for 2021? The clean energy trade seems overcrowded for now - JOHN DIZARD Opinion FTfm
Coinbase direct listing set for April 14th
Gray Television plans to buy Doraville's Assembly, create film and entertainment hub
Tesla deliveries in Q1 up from 88k (2020) to 184k
U.S. job growth accelerates in March; unemployment rate falls to 6.0%
I computed the weighted average upside for >100 ETFs. Here are the results.
ARKK Morningstar review: Unrestrained, Unaware, and Unconcerned
Daily General Discussion and spitballin thread - April 02, 2021
Investing w/ Climate Change on the Horizon
ECB Balance Sheet increased by over €300 Billion in one Week
"Micron Soars On Chip Shortage ""Perfect Storm"""
If you own a Computer, you have to play this game. No Install.
”Tether's claims that its virtual currency was fully backed by U.S. dollars at all times was a lie,""" - NYAG"
Opinion: SUNW is a pump & dump. Tread carefully.
ChargePoint (CHPT) Due Diligence
Investment in developing countries
BofA Global Research - Bitcoin's Dirty Little Secrets
Supercharge Your Study With the Phlinx Browser Extension - Quickly look up any word, person, place or entity mentioned on any page. Whatever you long click you’ll get a sidebar full of useful information!
Canadian Bitcoin ETFs available on Fidelity by enabling International Trading
Daily General Discussion and spitballin thread - April 01, 2021
Microsoft wins U.S. Army contract for augmented-reality headsets, worth up to $21.9 billion over 10 years
Quantifying Beta Slippage (Why Leveraged ETFs are Not as Scary as You Might Think)
ZDGE - 80% revenue growth at a 45 PE ratio offers 90% upside (DD)
MKTY, the undiscovered biggest competitor of Riot and Mara
Goldman Sachs is close to offering bitcoin and other digital assets to its wealth management clients
My take on Gold's longterm outlook
Daily General Discussion and spitballin thread - March 31, 2021
FTC files suit against Illumina (ILMN) to block vertical integration with Grail
How an energy firm tied to billionaire Warren Buffett plans to save the Texas electric grid
Might be a good time to short the Japanese stock market. It isn’t news yet, but another state of emergency looks likely in April
Don't Confuse Archegos Collapse With Contagio - By Aaron Brown
PayPal to allow Americans to pay with Bitcoin, Ethereum at millions of vendors
Klarna - possible 2022 IPO
ARK Space Exploration ETF (ARKX) - Holdings Reveal
Daily General Discussion and spitballin thread - March 30, 2021
Catalysts for novavax stock price
Negative numbers in financial statements.
Stock Scraper Trending Data as of 03/29/21
ARKX top holdings by weight
Ahchegos Capital Management
Activision Blizzard DD: Short Analysis
Largest venture rounds in AQSE?
Daily General Discussion and spitballin thread - March 29, 2021
BREAKING: NeuroRX (BRPA) Announces Successful Phase 3 COVID Drug Trial Results
Failure of the fund to meet margin commitments, Credit Suisse and a number of other banks are in the process of exiting positions
Finding financial numbers by country or geographic location.
Large fire at Indonesia's Balongan oil refinery in West Java
Thinking about getting out of BND and picking up series I bonds.
Investing in Helium - DMEHF DD
Still tracking your investment portfolio in a spreadsheet? Don't waste time manually adding all those holdings, trades, & dividends. Sign up to Sharesight FREE and use the web's award-winning portfolio tracker today.
ARK is amending prospectus language for its ETFs
Coursera: A DD Introduction
Bubble Deniers Abound to Dismiss Valuation Metrics One by One
Daily General Discussion and spitballin thread - March 28, 2021
Palantir Technologies (PLTR) DD
Highly Leveraged Hedge Fund Rumored to Have Imploded: Some Stocks Remain Heavily Discounted
Bonds vs Stocks and Short Term Returns: Now is not the Time to Panic
[$BB] The size of the real-world driving datasets that Blackberry IVY has access to will be so much bigger than Tesla's
Wework announces merger with BowX to go public
Ben Felix Proposed Five-Factor ETF Model Portofolio
Plugging In: The EV Transition Gains Speed
DD on digital health company OptimizeRx (OPRX)
Daily General Discussion and spitballin thread - March 27, 2021
For spot buy and sell orders using API, how determine limit prices?
Open orders tracking?
The Degen's Playground: My Opinion, as an Ethereum Acolyte, on Binance Smart Chain
Fees? 🤬🤬
FrX
How to move funds from Cross margin to Spot wallet?
Trailing stop order killed all my profits???
When is the next BNB burn date
Funds missing
Shitpost
Can’t access account, no one responding to my inquiries
Your Opinions?? Should I liquify these assets at a profit margin of 40%-50%? or after some months near the end of the Bull Run? Also holding ADA at 10% of the current portfolio stacked.
Binance extremely slow
Is Buying ANKR a Good Idea?
Does everyone have to use facial scan when they verify their account?
Why Binance just stopped XRPDOWN trading?
Need Some Help Please -- Recover USDT ERC20 sent to Binance US wallet via BEP-20?
Deposit not received from un_Minable to BTT wallet?
How Can I Earn On Holding Ripple XRP?
Earn up to 8% APY on your BNB. Passive income through compounding interest, paid daily - Start earning interest now!
LOCKED ACCOUNT SINCE DECEMBER 2020, PLEASE HELP
Launchpad bs
Does anyone have any idea and can help me
I'm terrified to do anything.
Just me or everything is in staking is in a foreign language?
IF BINANCE IS TROUBLING you use mandala.
Binance support
Card cashback
Confirmed and coming to binance
Why does Binance say 'XRPDOWN/USDT will be open for trading in ____'
remaining BNB after participating to launchpad of tokocrypto
Crypto to NZD
Should I not do trading on Binance?
Can I transfer USDT from Binance to Gate. Io directly without transferring to a wallet first?
High withdrawal fees from Binance to a wallet
VERYRARE™ collection 1 'Lullaby' out now 🛍 ultra limited named & numbered editions... go cop
Wrong Isolated Margin Balance
I didn't get the fiat currency I deposited. What should I do?
Noob question here. Will there be any issues accessing my binance account if i go to Canada? im in Asia btw.
Does send 1099 for any transactions?
How do I unstake funds bnb vault?
Feature request: The ability to make it impossible to go above a certain leverage from the dashboard.
Help BNB not deposited
Made SEPA transfer from bank account to Binance, not receiving funds
Can anyone help?
I commited BNB, it was on my screen as commited for about 4.5 hrs. Now it says I didn't commit, and that the BNB was returned to my account. What?
binance mobile app changed to chinese
I cannot withdraw my crypto to my metamask
(Hot) is Coming back!!!!!
Binance chain wallet - Insufficient funds
Why is my binance staking page in Chinese (?)?
Margin Trading Question - Margin Level to % Price Increase /Decrease, are my calculations correct?
Order failed error message
Binance should add these features. Upvote for visibility
Withdrawals have been temporarily disabled due to risk control
Accidentally traded my deposit EUR to RUB (Russian Rubble, don't ask me why). But can't change it back, nor can I withdrawal it.
Minimum deposit using debit card?
Binance from Canada
Error trying to commit bnb to tonocrypto
How do I increase the amount of money I can borrow on binance isolated margin trading?
How can I deposit XRP?
The best combination of FPS and Roguelite ever created. Ziggurat 2 now on Early Access!
whats going onnnnnn
[P2P] What is Payall in P2P?
Price prediction BNB end of the year 2021
What’s the difference between each network’s?
What takes Binance to list a new crypto?
What is your opinion of OMI? Soon in binance ?
Funds stuck in binance.com in USA
Commited BNB not appearing in EARN wallet (binance.com)
Get The Most Advanced Charting Software For Crypto FREE Only For Today. Create custom workspaces, and chart across over 75 exchanges.
PayPal denied proof of order available on binance.
Does this exchange even have a customer service?
Fees report
Harmony one
Binance (Aus) - Having trouble with additional verification to allow for deposit/withdraws.
BNB hits 400 dollar 🚀🚀🚀
Sent ETH from Chain wallet (wrong network) to exchange
Cant view wallet after update
How long for a deposit to hit binance_us?
Il n'est pas trop tard pour repousser les limites de l'humanité. Découvre le centre Bright Dimension où les non-gamers peuvent développer leurs aptitudes😉 #Windows10
BEWARE OF THIS SCAM ON TELEGRAM
Is there an official discord server?
Question regarding Fee Structure of Binance
Pundi X, balance disappeared
My 30 days locked up staking already finished. Why my ADA still locked? Sorry I'm still a newbie. Can someone tells me? Any processing days until my ADA back to spot account? Or because I stake in two different (30 [5.09%] & 60 days [7.79%]) staking?
XRPDOWN is closing
I had no problem withdrawing from Binance.US but now this message popped up. Is it because I recently made too many withdrawals? How can I resolve?
How
BNB minimum withdrawal
Hey guy I'm a Binance.US user, my phone previously went all black and I can't find a way to actually copy the phone to my new one.. I had google authenticator which I thought made it able to log in on other devices but it doesn't seem to be working quite a few bucks on the line...
A revolutionary embedded tier system token
Binance is not doing enough to prevent fraud
Can't say I'm surprised
how come i cant buy with paypal anymore ?
How did I just pay almost $100 more than the all the high for BNB
Card tiers: will binance one day adjust thier card tiers?
Sent XML to Binance while XLM Deposit Suspended. Help!
No action on tickets! Crap cust service!
Swift transfer (Withdrawal)
IIROC and CSA attempting to regulate cryptocurrency platforms. How will this impact Canadian users?
[URGENT] So I deposited fiat money into my binance account via SEPA bank transfer and it didn’t come so i reached out to Costumer Service and I just want to know if i’m talking to legit binance support; is it ok if I give these details away?
19k Funds Locked for 3 weeks. Desperate.
[help] XLM Suspended
Binance.us - withdrawals
Get in Early! Knights Defi! Deploy your Crypto to Battle for you!
Imagine un monde dans lequel les nombreuses aptitudes des gamers seraient recherchées… et partagées avec les générations futures pour repousser les limites de l'humanité par le gaming. #Windows10
Sms verification not working...
BINANCE NOT ALLOWING US TO SHORT BNB COIN? PUTS A 50DOLLAR LIMIT ON SHORTING?
USA User Unable to Log In to older Binance.com Account
Anyone else waiting for their tickets to be resolved?
Binance Bridge - Metamask Wallet - Missing Tokens
Balance change overtime? Or even better, individual coin gain/loss
Binance.US - Wire Withdraw stuck - didn't receive PrimeTrust email-29 hours still waiting
Why would you wanna miss out?
Pls close open ticket!
Issue transferring binance from trust wallet to binance exchange.
Binance
Question about coin pairs
Hacked funds from my wallet being sent to binance .. need help.
I am trying to early redeem my staked coins but i cannot
Send funds to Binance wallet via the wrong network
HELP. Hey guys! Just did a swap in PancakeSwap from BNB to USDT but i never got the USDT in my wallet (trust wallet) knowing that i have maid previous swaps with different coins and it worked every time now i just don’t know where the USDT went. If anyone knows anything please help. Tnx!
VERYRARE™ 2021 V®️R®® c/o Raf Reyes SS01 ‘Lullaby’ launch/foundation year collection 🤺⚔️™ available now at www.veryrare.co
How do I get WazirX coin off Binance as a US citizen.
I just received almost 15 emails in a row stating my advanced verification is unsuccessful. I tried this maybe a few months ago. But no dice.
Can you switch old Pundi X to new Pundi X on Binance?
Alt Exchanges - Scared of Binance US - Can't exchange crypto at all on Binance
Some ways to get free crypto
Recap of the Meter.io AMA with founder Xiaohan Zhu - Best L2 Solution on the market
McDonald's Teases NFT Big Mac
Blockchain.com Lists Polkadot, Aave, and YFI
VanCatToken
Good Bois Welcome: This Nashville Boutique Hotel Accepts Dogecoin
Bitcoin Rally Creates Nine New Crypto Billionaires in a Year
$400M African fertilizer deal executed on blockchain eases COVID-19 slowdown
PI Cycle top indicator -predicting end of bull market
Bitcoin price slides 5% as second day of losses costs Ethereum $2K landmark
Football star Tom Brady to launch his own NFT platform
Tokocrypto (TKO)
DeFi needs regulatory clarity to interface with ‘real-world’ finance, experts say
I don’t know who needs to hear this but...
Latvian Airline Starts Accepting Payments in Dogecoin, Other Crypto.... what the hell? really?
Are you subscribed to any 'closed' crypto club for early crypto picks?
Avoid B I N A N C E launchpad discount sales
Bitcoin Dominance!
Market Cylce/Season
CEO of biggest crypto exchange has ‘close to 100%’ of net worth in crypto
If you wanna feel miserable but Reef!
Need help to copy wallet
Jump Trading makes equity investment in sports fan token ecosystem Chiliz
Coinbase would have earned $2B just buying Bitcoin with its seed money
If you’re tired of hearing about meme coins
Bitcoin Price Drops as Kimchi Premium Fades Away
Are we just scratching the surface when it comes to what NFTs are capable of?
Sweden’s central bank completes first phase of digital currency pilot
What do you think?? I think it will go to the moonnn
Why Coinbase $1,8B Q1 earnings are bullish for Bitcoin
Staking Platform | Reward is now up to $324,493.128
ETH NFT = Digital Token PLUS Physical Minted Ethereum Coin! THIS is what NFT is all about!
UK Bitcoin mining revenues soar but China hogs 75% of ‘blood coin’ production
Wondering why VITE labs is up 54% this week ? Watch the video
A little bit about $HOGE
$FAIRGOLD 93 holders at the moment. Have not mooned yet!
Hold that line on Doge
Cryptonovae: multiple exchanges trading
Competition for PoolTogether
