How banks can identify money laundering involving crypto, explained
Biggest scam out there...
Tether Announced To Launch USDT Stablecoin On Polkadot And Kusama
Goldman Sachs CEO believes Bitcoin regulations are set for a 'big evolution'
Record first quarter for institutional crypto investment products: CoinShares
Jeremy Allaire: 'USDC is halfway to flipping PayPal'
Traditional Islamic values in investing have become available thanks to Caizcoin
WARNING: Satoshi Swap Impersonator spotted on Etherscan!
My alt portfolio! Let me know what y’all think!
Coinbase's first quarter revenue hits record $1.8B ahead of its Nasdaq listing
Community Opinions LCGs
Crypto Gold Rush reviews BlockSwap: Fixed income payments derived from PoS yields, ETH to start
Regarding KCS
Nifty News: Playboy's revealing tokens, SNL’s NFT skit sold as an NFT, and more ...
I believe TORN token (tornado.cash) is a real gem among a bunch of trash. Open for arguments.
Encrypted messaging app Signal enables private payments using MobileCoin
The chart has spoken!
Tell Me What's Missing...
🚨 scam alert $MONKE 🚨
BitMEX's Arthur Hayes surrenders in Hawaii, released on $10M bond
Shill me..
$OMI: Jurassic Park and Star Trek confirmed for this quarter!
Balancer clarifies: Balancer Labs is NOT partnered with Algorand
Orbs Introduces Single-Sided Liquidity Farming to Optimize Defi Returns
Best to buy now and cash out in 6 months
Ripple wins access to SEC discussions on defining crypto assets as securities
Chamath Palihapitiya DESTROYS Warren Buffett On Bitcoin
$BOG - BogTools: Relatively low-cap BSC tech utility token for traders to maximise their profits
Chainlink (LINK) Crypto | Honest Price Prediction
Reminder to Accumulate some Basic Attention Token - BAT
New Kind of Network (NKN) gains 340% to become ‘the biggest blockchain in the world’
Remember when I told you to ape in $blink when it was .10?? 2 days 400%
Daily Discussion - April 06, 2021
Cryptocurrencies Now Worth More Than American Banking 🏦System
Coinbase Q1 revenue jumped from $190M to $1.8B ahead of public market debut
FAIRMARS, Missed every token that launched into the moon? Now is your chance!
Former BitMEX CEO Surrenders, to Face Trial in US
Safemoon will AT LEAST triple in value within 6 months
Why my money is on Cardano, Chainlink, and BNB instead of Litecoin, Bitcoin Cash, and…
KCS (KuCoin Token)
$BINGUS - New BSC Coin
dogecoin: the movie
Dogecoin Spiked Because Of This!!??🚀
Ripple Wins Ruling to Expose SEC Docs on Bitcoin, Ethereum
Saturday Night Live NFT of NFT Skit Sells for $365,000
Bitcoin may briefly flatline as support grows for next breach of $60,000
Polkadot futures open interest hits $1B as DOT price reaches a new ATH
Rewards system allows decentralized messaging app users to earn crypto
Overview of different crypto storage projects
Alameda Research invests $4M in Vietnamese DeFi project
Goldman Sachs CEO: ‘Big Evolution’ Is Coming to Bitcoin Regulation
Coinbase Posts Blowout Q1 Profit of $730-$800 Million Days Before Public Listing
$LAI - Laika was in orbit and will also be the dog on the moon 🚀🌜🐕
Shill me your coins!
Celer (CELR), Cartesi (CTSI) and Compound (COMP) rally as DeFi heats up
🚀 🌙 Have you heard of $PIT? It's still early to get in on this gem! Not financial advice, make sure to DYOR! 🌙 🚀
New coin for trading options on the ethereum network. Just the beginning. Options.Market is a protocol layer for creating, trading, and redeeming fully-collateralized options contracts for any ERC20 token. Available on uniswap $OSM. 🔥 $300 trillion market 🔥
Adoption Over Hype - TONE
Real-world data comes to NFTs as street artists geotag their work
NFT tickets will revolutionize the ticketing industry - a bullish case for GET protocol
Lightning Protocol - The First Big Incubator/Launchpad for BSC!
MELLO Smart Contract TECHRATE Audit Passed! 🟡™
BlowFish MillionaireMakers Launched! Crypto lottery DApp 💸💸💸
PooCoin new Buy & Sell Feature is CRAZY! <3
Men's College Basketball Player of the Year Luka Garza Selling NFT
Paxos applies for clearing license with SEC following successful pilot tests
$OCTA - The One that stands out from the crowd.
Hurry up your new limited edition lambo might be very close to you!!
Privacy Chat App Signal Rolls Out Cryptocurrency Payments
CoinMarketCap removes South Korea crypto exchanges from Bitcoin price tracker
Oracle Token Chainlink Replaces XRP in Grayscale's Strategic Large Cap Fund
Innovative Bioresearch (INNBC)
Swapped shitcoin on Pancakeswap for BNB and received nothing. What happened?
$2.52B in bearish Bitcoin options signal pro traders are hedging their bets
Did you miss FEG and SAFEMOON? CYBERMOON is Next Moonshot!
Crypto lobby groups are gaining traction in Washington as the threat of regulatory bottleneck looms
Sending BNB from Atomic Wallet to MetaMask
$DRIP - Earn an easy 60% monthly dividend
Can crypto trading and investing be taught in just one book?
27% of Americans Are Familiar with NFTs: Poll
✅Initial Liquidity Offering on UniCrypt: Bonus 11,11%
Stellar Cryptocurrency Nodes Go Dark for 9 Hours and Counting
Need opinions on decision!!!
Russian lobby group launches new campaign against anti-crypto laws
Crypto News Briefing: XRP to $4? Near Rainbow Bridge? King's Ransom Paid in BTC? & more... - CryptoAndCoffeeLive on Twitch
MOB to be integrated into Signal Messenger (already working in the UK) - millions of users => moon
Just got scammed(fshiba)
$DMDHANDS Token | A crypto that rewards those with DIAMOND HANDS 💎
Are you shopping online and you have a portfolio🧐
SeedSwap ($SNFT) (DeFi/Staking/NFTs) now launching Social Media on platform (seriously undervalued, sub 1m mcap)
Doge to Digi
NFTs are accelerating Topps' digital transition, says chair
Typhoon Network - TYPH
Is Octans ($Octa) a Scam?
Luxury Nashville Hotel Takes Bookings in Bitcoin—or Dogecoin
Thunderbolt⚡️ is Breaking the BSC at the Moment.
Coinbase and Square lead new crypto lobbying effort
Prep time with Bitcoin: Students have fun new ways to study crypto
You got a $WENR? Want to see it grow bigger? Wanna support Testicular Cancer Research? Welcome to the $WENR party!
Hodl Everything
$MEE - Mercurity Finance. NASDAQ company enters DeFi space - 7M mcap
Late night moon shot $EULER
MEMESTOKEN $MEMES - a bright future for fellow memers
Grayscale Adds Chainlink to Its Digital Large Cap Fund
DOV Was Just Listed on WhiteBIT
After breaking $100 billion TVL, DeFi is now the equivalent of a top 40 U.S. bank
What are your top picks from today till Friday?
Anynone bullish on dent?
Bitcoin falls below $58K as Bloomberg eyes $80K BTC price in Q2
How do I get my money out of this shitcoin?
$RAPTR - [100k MC] PhilosoRaptor - Gem in the making!
Mark Cuban-Backed Nifty's Hires NFT Copyright Expert as CLO
Sold 1 billion safemoon for 60 $
Why do we never hear about the Expanse blockchain here? Seems like the project is still going strong with lots of Dev for 2021 and yet not a peep about it.
Meter (MTRG) is actually the moonshot we've all been looking for: $24m market cap, VC investment, awesome partnerships, doxxed team, great whitepaper, great project with awesome utility.
Mining Manufacturer Ebang Launches Cryptocurrency Exchange
Deep look into $SOAR, the next crypto gem
POOCOIN APP has just officially released 'Premium Tier 2' which allows you to track the Buys and Sells on the chart of your or ANY WALLET - game changer. All you need to do is hold $300 of Poo/BNB Liquidity.
ADA - Cardano - Crazy Community
Why does everyone still sleep on eGLD (Elrond)?
Kicking myself for not putting a few hundred dollars into Safemoon when I first heard about it in early March. Would it better to buy some now or put the money into a newer similar cryptocurrency?
Expert analyses Tron (TRX), Zilliqa (ZIL) and BitTorrent (BTT) price for 2021
UNICEF CryptoFund Gets $1 Million in ‘Institutional Bitcoin’ Donation
Sacramento Kings to Offer Players to Get Salary in Bitcoin - CoinQuora
Bonus dans GTA Online: Que vous soyez sur deux ou quatre roues, réalisez 5 cascades pour obtenir un bonus de 500 000 GTA$ sur votre compte Maze Bank dans les sept jours suivants. Ainsi que des récompenses triplées dans Capture d'ozone, des promotions et plus. Jusqu'au 8 avril.
Chainlink Outperforms ETH by 11% Per month, Putting LINK at $67 by May - Ethereum World News
Coinsloot is selling out faster and faster...
Ripple's Small Victory In Court in It's Battle With The SEC - But This Small Win May Lead To A Huge Victory...
Goldman Sachs CEO predicts a big evolution in Bitcoin regulations
North Korean Hackers Threatened Bithumb With a $16M Ransom - CoinQuora
"Billionaire Mark Cuban Thinks Ethereum Will ""Dwarf"" Bitcoin", ETH Sets New Record-High of Over $2,150
Grayscale adds Chainlink to its portfolio to meet institutional demand
Bitcoin miners earn like gods, when collected more than $ 50M / day in rewards over the past month
Cardano backing cFund has announced its first investment in COTI. Cardano and COTI had also partnered up before especially for ADA Payback in 2019. COTI is now setting up the new ADA Pay for Shelley Mainnet, releasing soon.
CoinMarketCap Temporarily Removes South Korean Exchanges - CoinQuora
RioWallet V2 Launches with Cross-Chain Interoperability
Cardano Foundation unveils first deployment of its supply chain solution with Swiss company Scantrust
Decentralized Finance Protocol Balancer Coming On Algorand Blockchain
‘HandyPick’ Becoming more Popular - Downloads Over 400,000
My Passive Income & Masternodes Payouts For March
COTI Receives VC Investment From Cardano’s cFund - CoinQuora
Visit five Top-Rated Beaches in Portugal with XcelTrip Decentralized platform.
Collect Taxes More Effectively to Avoid ‘Debt Trap’ Chaos, Warns IMF
The NFT hype: latest trends in Blockchain
Chainlink Pumps On New Grayscale Announcement
Tokocrypto (TKO) on BINANCE LAUNCHPAD
Ripple XRP Huge Win Against SEC & Coinbase Massive Revenue of $1.8 BILLION Ahead of IPO - NBA Sacramento Kings Bitcoin
Controlling Your Identity & Money with Mark Anstead, Co-founder of Numio
Zenon Network launched Public Testnet, Public Explorer and non-custodial wallet on 3/21. Decentralized platform project has opened access via a new wallet, S y r i u s, to participate in the testnet.
YIELD App Medium - Layer 2 Solutions can revive DeFi trading
THIS WEEK ON MONERO TALK: Peter Todd on Bitcoin’s and Monero’s Security Risks
Credit Suisse, Nomura’s Instinet Achieve Same Day Settlement using Paxos Blockchain
EarnBet awarded best gambling dapp!
Dan Simerman on IOTA's Evolution Since 2017 and Coordicide
DOGEbsc," the ""DOGE to help all Dog(e)s is now trading on DexGuru", the DeFi Trading Terminal
A Unique Supply Chain Solution Has Been Implemented On Cardano. Could This Challenge VeChain?
Will EIP-1559 Upgrade Turn Ethereum Into a Deflationary Asset?
Litecoin Creator Charlie Lee Joins BTCS as New Independent Director
$STC Next big platform for NFTs check it out https://stctoken.us/?ref=Sx7h2sif88
Cardano Venture Fund (cFund) Invests In COTI in Preparation for Smart Contract Implementation
All-In-One Crypto Trading Platform Atani Adds $6.25M In Seed Capital - CoinQuora
Binance Coin (BNB) Overtakes $400, Sets New All Time-High - CoinQuora
UniSwap Will Lists Deeper Network (DPR) on April 10 - CoinQuora
Metis Launches Alpha Test Net for Layer 2 Rollup Solution - CoinQuora
Cardano Beats ETH, DOT in Github Highest Development Activity - CoinQuora
XRP breaks above $1, retaking 4th place among top cryptos
Concordium Launches DevX Initiative to Support Rust Devs - CoinQuora
PangeaSeed Foundation Will Launch A Dedicated NFT Collection On Kalamint As A Fundraiser During Earth Week 2021 For Ocean Preservation
Bitcoin and Crypto Market Smashes Through $2 Trillion - CoinQuora
NFTs Will Emerge Stronger After The Bubble Bursts
Cardano ecosystem venture fund, cFund, makes first VC investment in COTI
Grayscale Adds Chainlink To Digital Large Cap Fund (GDLC)
Bitcoin Reaches 6% of the US Dollar Size - CoinQuora
Cardano reveals its first supply chain solution in association with Scantrust
ASI is the Next Level of DeFi. Artificial Super Intelligence For Smarter Token Rewards.
Mohamed El-Erian: ‘Bitcoin Is Not Too Big To Fail’
Sacramento Kings Offer Bitcoin Salary Option For Employees
How NFT Tokens are Different from Normal ERC20 Tokens
VeChain (VET) price analysis: Retains bullish phase for the 3rd day in a row - Morning Tick
Dash Core Group Hires New Marketing Manager!
Masternode Portfolio March Update #REALROI
Sound Ventures to Promote Crypto Innovations in NFTs
This guy is killing it Day Trading bitcoin... almost 10X in 2 months
Boosting network decentralization with P2P
Tether USDT Stablecoin Coming on Polkadot and Kusama
The Wisdom of the Crowd: A Crowdfunding Proposal from Innovatio
Tron price analysis: TRX continues upward momentum amid technical correction - Morning Tick
Decentralization unpacked with Colin Edwards, Duncan Coutts, Lars Brunjes & Shawn McMurdo
Bitcoin Reaches 6% of the US Dollar Size
Hoskinson outlines Cardano’s roadmap and innovations into 2025
Two Coinbase Employees Get Married On Ethereum Blockchain - CoinQuora
Winding Tree’s ORGiD Bot Revolutionizes Identity Verification on the Blockchain - CoinQuora
CoinShares Launches Physically Backed Litecoin ETP
Grayscale is 100% convinced that it wants to convert the Bitcoin trust to the ETF
IOST powers Japanese Manga NFT’s on NFT Marketplace TokenLink
MicroStrategy Holds Almost 100K BTC, After Recent Purchase - CoinQuora
Kimchi Premium Drives Bitcoin Over $68,000 in South Korea - CoinQuora
Gaming Startup Lepricon Seeks to Drive Mass Adoption of Blockchain Technology
iOS App Stole $1.6 Million In Bitcoins From Users
Purestake Completed $6 Million Funding Round For Moonbeam Smart Contract Platform For The Polkadot Network
Digital Marketing is best done with a team. Reach your Marketing Peak with Foster Web Marketing!
Indian Crypto Exchange WazirX Experiences Network Outage - CoinQuora
10 Largest Venture Rounds In Crypto And Blockchain
Algovest Audit Report
How DISCIPLINA will change the education sphere
How does Bitcoin work? Here is the view of the mainstream media.
You Are Up Over 3000% If You Bought VeChain (VET) A Year Ago and Held Until Today
Bitcoin Mining Step-By-Step Guide for Beginners
DRC Global Media Interest Survey
Imagine un monde dans lequel les nombreuses aptitudes des gamers seraient recherchées… et partagées avec le plus grand nombre pour repousser les limites de l'humanité par le gaming. #Windows10
Anthony Scaramucci: Ethereum (ETH) Would Continue To Grow Because It Has Good Fundamental
NBA Franchise Sacramento Kings to Pay Staff In Bitcoin
XRP New Partnership Announcements Pump It To 3 Year High
China Creates its Own Digital Currency, a First for Major Economy
Setting Up Online Casinos & What EthRoll Is Doing to Make it Easy
Algorand (ALGO) Crypto | Honest Price Prediction | HUGE GROWTH AHEAD!
XRP Goes Parabolic Aiming For $1 & Grayscale To Convert GBTC to Bitcoin ETF
Ripple CEO says that each Bitcoin transaction costs 75 gallons of gas
Some Musings about the Roadmap
MicroStrategy Stock Spikes Following Another Big Bet on Bitcoin
DigiMax (CSE:DIGI, NASDAQ OTC:DBKSF) Provides 2021 Q1 Corporate Review and Q2 Outlook
Polkadot News Today | Parachain Auctions Date Announced !!
Investment due diligence is what separates professional investors from beginners. Mandalore Group are such professionals, they are always conducting high level research and investigations. They are vetted experts in this field and always researching the best opportunities that you deserve
CRYPTOCURRENCY NEWS TODAY in 60 seconds | Bitcoin BTC | MicroStrategy | ...
Tesla for Crypto
Classmate Reunion - parody video about new crypto coin
Cardano Beats Ethereum, Polkadot to Top Blockchain with Highest Development Activity on Github
Healthcare Revolution: Solve.Care Releases the Care.Protocol
CryptoCodeSchool V2 Has Launched Including NFTs For Its CryptoBots And An NFT Marketplace
Polkadot Weekly – All of the latest Polkadot news for the week of April 5, 2021!
Cryptocurrency Market Hits $2 Trillion, Doubling in Just 3 Months
You Can Still Make It: The USDT 30,000 Giveaway for PACT Token Holders Is Mere Days Away
Crypto Regulation News: PayPal to start letting US customers pay in Bitcoin at global merchants…
Stellar price analysis: Spikes toward $0.4820, XLM hints at major breakout - Morning Tick
WazirX (WRX) Attains All-Time High Amid NFT Platform Launch - CoinQuora
Bank Of Japan Starts First Phase Of Its CBDC Pilots
What Is Theta Network?
Projects with ongoing migration from Ethereum to Cardano
Two Coinbase Employees Tie the Knot on Ethereum Blockchain for Just $537 in ETH
Chainalysis has raised about $100 million in Series D financing conducted by Paradigm. Read this article for more detail.
Grayscale Wants to Turn Its Bitcoin Fund into an ETF
Create your crypto homepage on Coinbench.com: Read news, track your portfolio, get push notifications on new updates
Important Notice: SafeCoin Swaps to customized Solana Codebase, “Community Edition”
Popular Bitcoin Market Indicator “Kimchi Premium” Nosedives In Hours
12 Best Ethereum Wallets for 2020 – Comprehensive Guide
What are Moving Averages? Overview, Usability & Types
What Are NFTs and How Can You Take Advantage of it?
A potential Bitcoin price explosion above $60,000 is brewing: Here's Why
Lepricon and BEPRO Network sign development agreement to develop FansPredict
Coinshares: Cryptocurrency Inflows At All-Time High In First-Quarter Reaching $4.5 Billion
https://vm.tiktok.com/ZMe5v7HjV/
Just bought my first SAFEMOONS! Haven’t done much DD on it but hopping for the best. Any thoughts or advice is welcome.
1INCH Breaks Out and Aims for New All-Time High - (TA - 7th of April)
Ripple gets access to SEC’s internal discussion on determining BTC and ETH as not Security
North Korean hackers got access to personal data and customers’ funds. The hackers targeted the crypto exchange Bithumb by asking them for 20 billion won. The hackers associated with the theft of $75 million from firms in December 2017
Bithumb was threatened by North Korean Hackers – $16 million Ransom demanded
Analisis de Mercado BTC, ETH, CARDANO, ICON, ELROND, SOLANA, THETA, CAKE
Into the Cryptoverse: Real Estate Investors Are Joining the Crypto Space
US citizens can now shop at Amazon, Walmart, and eBay using eGold via Shopping.io. However, eGold will integrate Shopping.io on April 8.
Can You Get Rich by Buying $1,000 Worth of Bitcoin Right Now?
Crypto Michael Predicts Notable Surge in Price of Cardano (ADA) Ahead of Smart Contract Implementation
CoinMarketCap has removed some South Korean exchanges from its Bitcoin price calculations. The removal is only temporary to avoid arbitrage.
Introducing DTrade — Decoin’s tading platform
Déjà vu: Bitcoin Setup Near $60K Looks Similar to $20K-Breakout Delay
Tips To Keep Your Crypto Safe - Guide
Former BitMEX CEO surrenders to US authorities in Hawaii
Ethereum Price adds 13% versus BTC, Buyers Aiming for a Rally Back to Q1 2021 Highs
BitClout Is the New Crypto Social Network That Lets You Bet on People’s Reputations
NEO pattern breakout! 💚
Clever DeFi created a solution that guarantees set interest payouts, with a new automatic interest-earning platform
Great analysed Tron (TRX), Zilliqa (ZIL) and BitTorrent (BTT) price for 2021
Filecoin Is Hot Right Now. But, Will You Get Burned
Post ICO Buy-In (Is it even possible?)
UNI Airdrop
Top 10 Fastest Developing DeFi Projects in Crypto, and What Each Has Been Working On
ANALISIS - BITCOIN, ETH, CARDANO, BTCST, ELROND, SOLANA, SIACOIN, WIN
Only IDIOTS buy BTC
We’re now live!! YIELD App launches YLD-ETH SushiSwap Onsen pool. Read more through:
DIGI.CSE - DBKSF.OTC Artificial Intelligence-Blockhain Stocks Are Leading the New Wave
UK Financial Services Minister reveals plan to Regulate Private Stablecoins
Crypto Market Cap Soars Past $2 Trillion | BTCMANAGER
Concordium has launched the DevX initiative. The initiative will support developer growth in the Rust Ecosystem. Concordium follows the “first give, then get” approach.
Why my money is on Cardano, Chainlink, and Binance Coin instead of Litecoin, Bitcoin Cash, and…
Cardano has the highest number of average daily development activity It has left behind popular alternatives such as Polkadot and Ethereum This news comes at a time of growing interest in the blockchain’s developments
The sleeping giant - Akropolis
Top coins according to trend and momentum indicators April 6th
What's the crypto exchange with lowest trading fee?
Scalping BTCUSD - Cuenta en Bybit
Waves coin & Waves DEX: Ready for DeFo? - Exodus Wallet
Deepbrain Chain (DBC) Mainnet Launching Imminently --The Only Cloud Computing Project On Polka Ecosystem To Achieve Large-Scale Landing
What Motivates You Not to Panic Sell When Prices Droping?
Metis has just launched the Alpha test net for its Layer 2 Rollup Solution. The Alpha test net will give users exclusive access to try out special features. Users can create and manage their own decentralized apps on the platform.
If you had $1,000 would you spend it on BTC, ETH or the Coinbase ($COIN) IPO?
FRAUD ALERT- Read comment
You know at what price you buy, but you are dependent on the market to sell
Track real-time ADA price, monitor all ADA news and get web push notifications on Coinbench
There are a lot of people like this, but what are the things that you look for in an altcoin?
RSS Feed for a specific cryptocurrency
Why Uganda chose Stellar Lumens to power the currency of its new city
How to Buy Siacoin (SC)
Deeper Network (DPR) announced their listing on UniSwap on April 10. DPR provides true Internet solutions, freedom, and enhanced security. Smart contracts security of DPR has been successfully audited by
Institutions triple down on Bitcoin as network difficulty hits all-time high
The Mayor of Miami hosts Vitalik Buterin and The Cryptex Finance team to discuss Ethereum’s role in making Miami the Crypto Capital of the World.
Louis Pouzin’s Datagram Story Is There To Remind Us Why Being a Bitcoin Maximalist Is Common Sense
Binance.US Fee Chart by asset 🤯
5 of The Best Crypto Hardware Wallets to use in 2021
Stop loss and take profit
Binance Coin (BNB) overtakes $400 in Binance exchange, sets new ATH. BNB look forward to hitting the bullish price of $500.
Why Chamath Is Wrong About Inflation
Gemini vs Coinbase which is the best US-based exchange?
The Industry Must Have US Regulatory Reform Through Congress
Akon’s Crypto Initiative
Winding Tree just launched ORGiD Bot. The Bot will help users in the crypto space identify legitimate businesses in the market. It will use Winding Tree’s native token LIF to verify businesses.
Newbie to crypto, can anyone eli5 on how multiple coins can drop in price almost identically?
Bullish BTC price analysis on March 29 – April 4 is up to $60k-$65k. ETH may reach the skyrocketing price of $2200 in two weeks. BNB continues to maintain its position beside BTC and ETH.
What causes those synchronized 1h dips on very different cryptos ?
According to the Fantom Foundation, Afghanistan Railway Authority will now use its technology. Fantom has set out to implement blockchain-based tools to support Afghanistan’s digitization program.
Can somebody please explain me why my coinbase wallet shows this low value for my 108 open governance tokens. They should 2.6 each. It's my first time swapping coins and I'm a little bit concerned.
Top Bitcoin Influencer closes Bullish position on price dump fears
How Blockchain Can Prevent Identity Theft
Ideal $100 Crypto Portfolio
Introducing Sigmadex: Bringing financial stability into digital assets
#RioWallet is a decentralized application (#dApps), that allows users to interact with #RioChain to send and receive #cryptocurrencies, as well as to view their public key and manage other #assets. Only WEB WALLET available, we should keep our eyes peeled for Android and iOS version.
MicroStrategy bought another 253 Bitcoins. At an average price of $59,339 per coin. MicroStrategy increases its Bitcoin holding to over 90,000 BTC.
Crypto Lending Platform Nexo Faces Lawsuit for liquidating $5M worth of XRP in client collateral
Buy The Dip With The Help Of Fibonacci Retracements.
Binance vs KuCoin – Which comes out at the top during this exchange comparison?
How Can You Cash Out Large Amounts Of Bitcoin?
ANALISIS - BTC, ETH, BNB, ADA, SIACOIN, ICX, SOLANA, CAKE, 1NCH
Akon’s Real-life Wakanda City To Be Built By 2036
Cryptocurrency Market Value Peaks at $2 Trillion, As Ethereum Hits a New Time High
DeFi Reaches Milestone $60B Total Value Locked
One of the best price predictions video I've seen so far. A must watch if you are unsure of whether to HODL or SELL!
Crypto businesses - Private community for crypto/blockchain business founders
Snoop Dogg Prepares To Smoke A Dogge Coin With Elon Musk 'On Tha Moon' As His NFT Pieces Sell Fast
Bitcoin price in South Korea has surpassed $68,000. Meanwhile, the top crypto is trading at about $59,000 globally. The price difference is due to the Kimchi Premium phenomenon.
WazirX exchange is working to restore their network outage. This is due to the heavy load that occurred via their system.
Understanding Ethereum Tokens: ERC-20, ERC-223, ERC-721, ERC-777 Compared
