NYT: If You Care About Privacy, It’s Time to Try a New Web Browser | Brave
PayPal is not doing a good thing. Taking your BTC and selling it. Smh...
ZRX (0x) market seems controlled by bots
Bitcoin bull Mike Novogratz says he is shocked by the speed of crypto adoption
Goldman Sachs is close to offering bitcoin and other digital assets to its wealth management clients
Quipuswap (Tezos) massive new defi released today
CoinShares Reaches $4.5B in AUM, CEO Calls For 'Multi-Decade Supercycle'
Rejoignez la chasse ! Téléchargez l'édition Digitale deluxe maintenant
AMA with Evan Shapiro, CEO and co-founder O(1) Labs and Board Member at Mina Foundation
5600XT Ravencoin OC Settings Throwing Punchs with a 3060ti!!
With Uniswap V3 soon to be out what is going to happen to all the copy swaps?
Nice little adoption article. Author does seem to throw in a quick DOT shill, but whatever :)
Bitcoin or Burritos
FXTB Is the Premier Platform for Bitcoin CFD Trading
Anyone got a good crypto podcast to recommend?
Anchorage and Prometheum Partner to Bring Digital Assets to Non-Accredited Investors
NFTs as ID, what's your opinion?
Coinbase India
As a first step, the government should make tipping waiters/waitresses tax free.
Goldman Sachs Bitcoin Investment Offering Coming in Q2
In it for the dividends, feeling kind of shady and a cure for cancer.
Bitcoin may be 'very, very close' to an intermediate-term top, strategist says
CNBC Just in: Goldman Sachs is close to offering bitcoin and other digital assets to its wealth management clients
BTC’s dominance has declined from 72% to 56% within the last 3 months.
HMRC (the U.K. taxation authority) has published a Guidance Manual for the taxation of Crypto-Assets for Companies.
Over 600,000 USD Has Been Stolen From iPhone Users Because Of Fake Bitcoin App On App Store
Ripple (XRP), Tezos (XTZ), and Tron (TRX) Price Analysis for Mar 31
Bitcoin is THE BEST performing asset in Q1 2021
iPhone user blames Apple for $600K Bitcoin theft via fake app
Bitcoin could rally this April based on crypto’s historical data
Radio station ( NL ) giving away 1 Bitcoin
AIC website down?
$BOOTYBOAT - Holding stronger than ever!
DMT - Is this basically like r/place? But each pixel is a NFT? This could be huge
Low mcap transparent token - Time Capsule Protocol FM (BSC / PancakeSwap)
$BLZD - Blizzard.Money
$DGCL Digicol NFT platform release imminent! 1-click NFT creation - bringing NFTs into the mainstream!!
Guranteed 10x NFT Project - SENPAI launched 24 hr Ago MCap below 1 Million
Bee.Farm (BFRM)
$TCK - TechnoKing - Elon Musk - Next Moonshot! 🔥LAUNCH IN A FEW MINUTES🔥
$ELONSTAR
May I present to you, an absolute hidden Gem! This is the Industrial revolution 4.0!
$PEECH - Buy a bag and hodl, lottery coin that’s drawn every week!! Only 170 holders! JACKPOT $5k+
CargoX Mandatory in Egypt
$Kanye the new $Coinye with potential?
Verasity VRA : A platform agnostic blockchain adverstisement market disrupter (350 billion market)
Why is Publicmint (MINT$) a MoonShot: Book Of MINT$ Written by a Hodler
⭐ SafeSatoshi - 3-day-old BSC Token with moonshot-ready tokenomics
Fantom Foundation meeting with the Ministry of Urban Development and Lands of Afghanistan. The Ministry of Urban Development and Lands is considering adopting the Fantom technology. Mr. Gul Rahman Tutakhel emphasized the importance of digitizing information and administrative systems.
Tu n’es pas gamer et tu n’as que peu de chances de réussir dans la société moderne ? Ne cherche plus ! Le centre Bright Dimensions va te permettre d'acquérir les compétences nécessaires pour contribuer davantage à la société 😉 #Windows10
Bakkt Launches Bitcoin Wallet With Starbucks And More
‘One Bitcoin per Lambo, then one Bitcoin per Bugatti’, says Kraken boss as he tips Polkadot to be next Ethereum
US Topps Digital, Partnered With Wax Chain To Sell Godzilla and King Gidora NFT Collection
Crypto Trading Signals Platform
Aqualair: Latest Blockchain Protocol Based on Ethereum Technology
Daily General Discussion - March 31, 2021
What are your picks for next 10× gems?
Introducing GNY Dataplace | Spring 2021 Release
Iowa Lawmakers Pass Blockchain-Friendly Legislation - Decrypt
Fairmoon, ...is it the new Safemoon?
What Is The App Socios.com And The Great Chilliz (CHZ)? - Crypto DeFinance
MoonDAO (new coin, low market cap, Auto Reflect/Liquidity, 5000% APY)
Best Crypto Podcast ???
ELONMOON ready to take off!
No BTC - No Worries. My investment strategy that 99% of you will think is 100% DEGEN. I say it works 60% of the time EVERYTIME - tell me I’m wrong ✌️
Cheapest way out of Coinbase plus additional recommendations
Can Paypal Make a Crypto Revolution?
Uniswap and Moonswap MOON (Conflux main DEX) early days charts. Familiar numbers, don't you think?
RBC token is bumping, ready to invest. Your thoughts about it?
Visa and PayPal give Bitcoin a boost
New project found
SimplyVitalHealth ICO – NO Refund, what to do?
Kimchi premium
Bitcoin Trend Continues
You guys asked for it so here it is: I built a bot that buys Bitcoin when Elon Musk Tweets about it and open sourced it
Bulletproof TLS Newsletter Issue #75
Inversing Modular Exponentiation
Why is Sha-256 useful for certificates and file verification. Couldn't hackers intercept the hash too?
Book recommendations - mathematical cryptography for cryptocurrencies and blockchains
The Solution of the Zodiac Killer’s 340-Character Cipher
How to implement Chosen Prefix Collison attack
SHA-3 in R
Edward Snowden has a keynote speech today at the Priv8 Conference!
certificate transparency log
Password Storage - OWASP Cheat Sheet Series
Career/college path
Any standard for a digital communication security protocol which does not use any asymmetric primitives but 'modern' security?
The Sumcheck Protocol: Backbone of Modern Day zkSNARKs
How does PGP work compared to BTC sig address?
Let's talk about borders (and crossing them)
Why Session can't be trusted
Dropbox Vault, how secure is it?
AES Encrypting the same file with the same Key/IV
Bitlocker with Plausible Deniability
Signal protocol security of messages
I don't understand this implementation of TESLA for message authentication.
Arbitrary-length key derivation with libsodium
Starting out with a healthy amount of math knowledge
In standard DH (Diffie-Hellman)," does the group size determine the ""modulus"" used?"
How do zk-SNArKs work?
Different categories of cryptographic hash functions and popular attacks on them
How does the Apple/Google Exposure Notification system prevent infected users from being identified?
Asymmetric cryptosystem proposal.
I found a private key on my house.
"""One-Time Verifiably Encrypted Signatures"" about to get merged into secp256k1-zkp"
Is an AES key just a number?
Schnorr confirms paper is his, claims it “destroys RSA cryptosystem”
How secure is this scheme?
Compression of curve25519 public key points
Fast Factoring Integers by SVP Algorithms (Claus Peter Schnorr) - “This destroyes the RSA cryptosystem.”
"Ruffing: From the abstract on ePrint (not in the paper): ""This destroyes [sic] the RSA cryptosystem."""
Hi, I made this simple encryption algorithm that uses hashing and a sort of Caesar Cipher. What are it's weaknesses?
Crypto experts.... your country needs YOU
Bulletproof TLS Newsletter Issue #74
Roadmap for Learning Beyond the Basics from a Practical Side
Cryptography Book Suggestions?
Algorithms to generate one-use promotion codes?
Cryptography Interface Design is a Security Concern
J.-P. Aumasson: Should Curve25519 keys be validated? (2017)
"Is RFC3394 still the best approach for implementing ""envelope"" encryption in 2021?"
What are some possible jobs for Cryptographers?
How difficult is a cryptography masters with not much programming background?
What are some commonly used crypto standards today?
When a KEM is not enough
Best way to encrypt a file with GPG
Mining Bitcoin with pencil and paper - SHA-256 algorithm (2014)
What are the math prerequisites for Cryptography?
Chaos Runes: a set of tiles to generate high entropy passwords
$VRNS - Varonis - Leading Cybersecurity company
My take on Gold's longterm outlook
Daily General Discussion and spitballin thread - March 31, 2021
How an energy firm tied to billionaire Warren Buffett plans to save the Texas electric grid
PayPal to allow Americans to pay with Bitcoin, Ethereum at millions of vendors
Daily General Discussion and spitballin thread - March 30, 2021
Negative numbers in financial statements.
Stock Scraper Trending Data as of 03/29/21
Activision Blizzard DD: Short Analysis
BREAKING: NeuroRX (BRPA) Announces Successful Phase 3 COVID Drug Trial Results
Large fire at Indonesia's Balongan oil refinery in West Java
ARK is amending prospectus language for its ETFs
Bubble Deniers Abound to Dismiss Valuation Metrics One by One
Highly Leveraged Hedge Fund Rumored to Have Imploded: Some Stocks Remain Heavily Discounted
Bonds vs Stocks and Short Term Returns: Now is not the Time to Panic
Earn up to 1% on BTC, ETH, XLM, DOGE, LTC with BitcoLoan Crypto Lending Platform. Invest in crypto lending and make your assets work for you
Ben Felix Proposed Five-Factor ETF Model Portofolio
Plugging In: The EV Transition Gains Speed
Daily General Discussion and spitballin thread - March 27, 2021
Extreme Diversification Portfolio
Daily General Discussion and spitballin thread - March 26, 2021
The End of Tesla's Dominance May Be Closer Than It Appears
S&P 500 vs MSCI world index
Preferred shares ETF in Canada a quick comparison
Daily General Discussion and spitballin thread - March 24, 2021
Intel is spending $20 billion to build two new chip plants in Arizona
Microsoft ($MSFT) DD - Sitting on a gold mine
ViacomCBS announces share offer worth 3 Billion dollar
Some DD on Lockheed Martin LMT, or, how to play America, defense, space and the same time.
Interesting facts about brokerage insurance
Alternative Investments: African Agricultural Crowd Investment Platforms - Experiences?
iShares Global Timber & Forestry ETF (WOOD) DD - Bullish Case For Continued Lumber Prices & 2021 Outlook
Daily General Discussion and spitballin thread - March 22, 2021
$BNGO Bionano Genomics DD – The future of genomics is here. Why I am 100% bullish. HUGE Upside potential
Major railroad merger! Canadian Pacific is buying Kansas City Southern in a ~$25B deal - ~22% premium to Friday's close
DD on Poshmark (POSH). Why I think it is undervalued and why there is room for a lot of growth.
Binance bridge stole my ETH!
Binance.us in Texas
All in on Matic
Abnormal Withdrawal - US user on Binance EN
USER INTERFACE
"terrible customer service/pulling money and not crediting my account despite ""failed"" deposits/anyone else dealing with this?"
Ticket closed, problem still not solved.
[NEED URGENT HELP PLEASE] Withdrawal Suspension
Advanced Verification
Trading disable please help
Harmony One is going to the 🌝
Could the API be used to potentially create a sort of panic button for someone who holds many different currencies in small amounts?
Advanced Verification takes months
What is Zenon. New Crypto on the block
The Nexo Exchange makes buying and selling crypto and fiat fast, simple, and secure. Swap your crypto instantly, with unlimited transactions and 100+ crypto and fiat pairs. Start Exchanging!
My Birthdate Is Wrong...
Spot trading starting with £100, doable? Worth it?
There’s No being Late To Investing In Bitcoin
Can't move remaining balance from futures wallet to spot
help please~~~ ticket 4914343...
How the fuck do I sell a shitty crypto on Binance
Anybody has problem withdrawing XLM stellar lumen from Binance lately?
Binance $100 Million Accelerator Fund for PAID network.
Can someone help escalate my ticket? Going on three weeks with no response and funds are locked
Account name problem!
how long will it take to get a response from binance? I transferred some coin to the account but not showing? not binance us
Why are my holdings still showing zero wen I have BNB in my spot ?
Binance Super Prophet Query
Binance Referral For Anyone To Use :)
Card level: is staking included?
Selling property with crypto
How does the new regulation affect Canadians?
What should be the difference between stop and limit percentage wise?
Deposit stuck on pafrtial but no amount is available, WTF?!
A Deep Dive into Binance Smart Chain Ecosystem, and Top Projects Building on it.
[Help] Withdrawing Ethereum BEP20 to Trust Wallet
Binance will assist Pundi X (NPXS) with its token conversion. These tokens conversions will mainly occur in April. Binance will cancel all pending orders and delist NPXS/USDT and NPXS/USDT trading pairs.
6K NANO deposited AND confirmed into both my deposit address and Binance's hot wallet, but not credited to the account.
Chat transcripts
How To Make an Affiliate Website and Get Paid with Binance
Buy BUSD through third party
I cannot recieve bitcoin in Binance.sg
Have not received my fiat withdrawal
i sent BUSD and transaction is failed but my BUSD is deducted
[GUIDE] I Have Created The Absolute Beginner’s Guide to Cryptocurrency Investing
Stop Limit (Hedge Position) Expired - Forced Liquidation
Access binance.com KYC as EU resident, from US
Need help. Bsc
Cashbacks suddenly stopped
What are the benefits of using a Binance VISA card
showing 0 Bitcoin
Binance Chain Wallet - Invalid Chain ID error?
Have my account hacked ... they are trying to withdraw funds I need this stopped !
Price percentage gain/loss (green/red) displayed next to the coin price on Markets and Trades
I have purchased BTT via Trade-in Binance, the order has been filled but the coin is missing in the Wallet Fiat and Spot page
Transfer from MetaMask to Binance Fiat Spot Wallet?
How to create second account for automated trading, without additional KYC?
Finally! Here's the perfect solution for growing solopreneurs & small biz owners trying to get organized /move from paper or spreadsheets to apps even if you think it might not be possible to automate your task or developers are too expensive. Apply to get a prototype app in less than 7 days
Getting error: Available balance is lower than minimum amount.
The market value is not updating ?
BTC suddenly disappeared
Removing Credit/Debit Card Information
Accessing wallet details from Binance global app
30K TUSD are in my Binance wallet for 6 days are not credited to my account. Support is not replying. Please like and upvote for resolution ! I'm desperate..
Am I the only one having this problem?
No response to query on Binance app
Newbie here - need some advice - thx
Can you use the regular Binance app in the US or do you have to use THE Binance.US apple AppStore app?
binance.us users getting yield on BNB
BUSD Flexible Savings Associated risks
Best/cheapest way to transfer between Binance and Kucoin?
I had BNB in Binance smart chain wallet and i wanted to transfer it to Binance.us account. form Binance.us account i clicked on deposit. i deposited BNB tokens by selecting ERC20. the transaction is successful. i did not get the tokens in my binance.us account. Please let me know how can i get by co
Advice on futures
I had BNB in Binance smart chain wallet and i wanted to transfer it to Binance.us account. form Binance.us account i deposited BNB tokens by selecting ERC20. the transaction is successful. i did not get the tokens in my binance.us account. Please let me know how can i get by coins back
Binance supports PundiX swap
Gameuses, gameurs, le monde à besoin de vous pour repousser les limites de l'humanité par le gaming 😉 #Windows10
Binance bridge problem
Goodnight Reddit
TKO Tokocrypto?
Can there be Chargeback Scams on Skrill
Banxa scam ?
I never get any kind of response from senior agent!
How to deposit with USD from UK by using visa card and not silvergate swift?
Behind Every Successful Crypto Trader
no one answer my ticket and it seems stuck
Binance US New Listings
Today at Binance HQ....true story....
Any NFT platform on Binance like Rarible?
Shit posting day 4, feeling a bit lazy today
Question about Balance Details and closing out ownership of coins
Reopen chat ID
Earn up to 8% APY on your BNB. Passive income through compounding interest, paid daily - Start earning interest now!
Super Prophet Campaign weird results
I just need a Binance.us 20% referral
My account has been frozen for TWO MONTHS!
Accidentally sent BUSD-T (BEP20) from Trust Wallet to an ERC20 Binance Wallet.
Liquid swap question
[Suggestion] For liquid swap share PNL can we have breakdowns
Applying fee discount code / voucher code AFTER registration
Converting BNB from Trust Wallet to Binance
Locked out of Binance account - Suggestions?
Did I lose my BNB?
(BSC)How to check if address is a valid BEP-20 address?
Launchpad says 0 BNB
Got my XLM back
My problem while buying coin
#safemoon #newyork #bitcoin
Can my binance account get hacked by clicking a link?
whats going on with Binance Customer support ???!!!!!!!!
Our Indicator Predicted This Bull Run With a 100% Gain Since The Long Trigger.. Plus It's Completely FREE.
Battles
Binance acting strange
Pressure Binance Support
Anyone who uses iOS Binance app, did you notice any changes after the recent update?
Did I do the right thing?
Ticket marked as solved and closed for comment but nothing done
They are actually using bots
What’s up with this 😑
How to withdraw my crypto from Binance to coinbace?
Help with ETH 2.0 staking.
Safe .... but boring
Hi I need help. I always keep a personal track of my trades in a spreadsheet mainly because I use different platforms. Tracking my trades on binance is really frustrating because I don’t have many trades and my account balance is different from my personal.
Enjin secures $18.9M funding for Polkadot-based NFT blockchain
Bitcoin on ‘inevitable path’ to reach gold’s market cap – Mike Novogratz
MoonShot / SAFU PROJECT / TRUE GEM
SafeCoin (Solana community fork) looking like a sleeping giant before it explodes.
$FROGE - New world's first ECOCOIN - day 12!! - frictionless .1% every tx to save our rainforests - big week!! audits/cg/cmc/whitebit coming, more inside
A token called Easy100x just listed on uniswap
CKB the beast no one seems to be watching
$MEMES coin taking off!
Moonshot NFT $VIDT 73 Mil Market Cap
$DPH - Blockchain Solutions for Healthcare - TINY MARKET CAP!
Anchorage and Prometheum To Launch Alternative Trading System for Digital Assets
TOP ALTCOINS FOR APRIL 2021 | 300% Potential!
Elon Musk-ular
Goldman Sachs readying Bitcoin product for clients — BTC bounces above $58K
Goldman Sachs Bitcoin Investment Offering Coming in Q2: Report
Ok here is why $SHFT will be your best low mcap Q2 investment (BNB, Bitfinex, etc.. Partners)
$PIT's $20K Donation fee is officially raised for the WhiteBit listing!
What can cause a TWAP to fluctuate?
Atari launches nostalgic NFT collectibles for Pong and Centipede - Don’t miss out ATRI (Atari token) regarding gaming industry🚀
The Ethereum Improvement Proposal 1559: Is the squeeze worth the juice?
The Holy Roger Coin (ROGER)
UK crypto firms must now submit yearly financial crimes reports
Has anyone seen this video yet about BTT? Sounds like pretty solid analysis if you ask me. What are your opinions?
UK Tax Authority Updates Its Crypto Tax Advice To Include Staking
Digital euro could take four years, says ECB president Christine Lagarde
UK FCA Now Requires Financial Crime Reporting From Crypto Firms
BlueMoon - Make it Moon! 100x! Devs active! $10k mcap
Bitcoin Rejection At $60K Ends Five Days of Growth
Join the waitlist for the BlockFi credit card with my link and we’ll both start earning bitcoin soon.
👇Vote elongate if you haven't already👇
Cointelegraph on Twitter. Amazing growth for OGN after new partnerships
China's blockchain project BSN to integrate R3 Corda
Millions of Euros Invested in Alleged Bitcoin Fraud in Ireland
NPXS - PUNDIX swap
Swiss startup launches tokenized grain trading pilot
Bitcoin flash crashes by $2K in 5 minutes, liquidating $600M in longs
micro cap exchanges
Crypto Nears $2 Trillion As Bitcoin and USD Close Quarter on a High
Market dipping
$MOONI - A new gem with high potential
Gaming Coins For April
Anybody trading VEVE collectible NFTS here?
$MEMES - earn money with Memes and NFTs? Don't miss out on this, MEMESTOKEN is going to create a fully decentralized platform for this. More than 1k holders! 🚀 [$1.6M market cap, CMC, AMAs, Audit]
Anyone Able to Guess what Gaming Coins JRNY Crypto will follow tomorrow?
New in town
Frankie is not a financial advisor. Frankie's technical analysis is intended for educational and entertainment purposes only. Thank You.
Adam Back unveils Blockstream’s new Bitcoin mining security token
We may be down, but we are not out! Bullish AF
$MNMN - MoonMoon on BSC! New deflationary charity token!
French Firm Launches Euro-Pegged Stablecoin on Tezos (XTZ) HUGE NEWS
DOGE potential to hit 20¢
Akoin to be listen on a new exchange next month as price is ripe for picking.
Nifty News: NYT says NFTs in pandemic-fueled bubble, Polkamon eggs produce $1M gas ...
$SCOOBY launching!!! Want to be early? 🔥🔒💰
MoonMoon (MNMN)
Nic Carter takes aim at claims Bitcoin is an environmental disaster
Rate my portfolio (less than 1 month old)
Does BAT have a chance of being a silent mooner?
Sooo damn close, can we break $.10? CELR listed for first time on OKEx, one of the oldest exchanges.
the Network of Momentum
Hedera Hashgraph is doing what every other project promised they would have already done ✅ And it's only one and a half years old!!!
Tycoon.io (TYC) - last day for crowd sale
Michael Jordan, Will Smith join $305M funding round for NBA Top Shot maker Dapper Labs
One BTC will be worth a Lambo by 2022, and a Bugatti by 2023: Kraken CEO
Must watch 👀 Video clips ! Hello Future! Hello Hedera Hashgraph!!
LBRY fires back at SEC over 'aggressive and disastrous ' securities complaint
$NOIA made me $$$ and why it is still not too late for you.
Smartlands SLT: Protection In A Bear Market
$LIGHT the next x100
The blacklist: Marathon only mining ‘fully compliant’ Bitcoin transactions
What happened to the TNT coin? Did the developers give up on it?
Please comment anyone that is holding a bag full of nothing from the recent rugpulls
This recent News regarding Paypal + Visa is alot more bullish then we think
$MOONI New Community Token
$gpump
AMP Token
Dollar cost averaging *DCA) question
Is ELONGATE too risky even for meme crypto?
Daily Discussion - March 30, 2021
AXXA is a smart service and neural network ecosystem that runs powerful trading on cryptocurrency markets. *Launched today, March 30th*
How to buy and spend cryptocurrency using PayPal
How does cashing out a long position work
$11 Billion in ‘Fake’ Uniswap Volume Causes DeFi Project and DEX to Clash
ELONGATE - why u should invest
Why BTC will not be everyday currencies.
Lendefi, the actual Aave destroyer
Degens for cancer. New $LLT coin with charity wallet getting ready to moon.
$VOX $1.6M MCAP is about to get listed on a TOP 10 VOLUME EXCHANGE
New partnerships send Holo (HOT), Wanchain (WAN) and Origin Protocol (OGN) higher
OLY olyseum
Miami Mayor wants to turn the city into a bitcoin and other cryptocurrencies mining hub with clean energy
Doge perspectives
Inter-Blockchain Communication Enabled For Cross-Chain DeFi By Cosmos
CELR soon to the moon
This is here because /r/NFTCircleJerk doesn't exist yet.
A wholesome crypto-charity token I truly believe in: $BDOG, Bulldog Token, listed on ProBit and CoinsBit, Partnered with FEG, more incoming!
Why BTC will 100% go below 3k again...comments?
Bitcoin futures premium hits 30% but analyst says 'This time it’s different’
MoonDAO (New, low Market Cap, 5000% APY farming partnership, Auto Reflect/Liquidity Coin)
How and why I have become a virtual land baron in OVRLand
$LABS Group (69m Market Cap)
TNDR, BLZD, and SPACE - who did two kick ass and one flop?
Cheap Gas: Orchid Labs is using xDai to drive down the cost of its VPN
Warning to Bynance users in the U.S.
Coinbase Hires Former SEC Official at Critical Moment Before Public Listing
👇👇For Anybody looking to invest in elongate👇👇
Rogue Coin ($XRGE) - decentralised social media, unknown fresh gem with only 50k mc - marketing starts any day
Brief overview of Dock io; an easy 5x
From NFL to NFT: Vernon Davis Offers 'Golden Ticket' Meet-and-Greet for Fans
$Octans $OCTA Burn Redistributable token. Making waves today. Up 260% and gained almost 400 holders today. New Elongate?
Edward Snowden: Bitcoin privacy sucks
This Bot Buys BTC Every Time Elon Musk Tweets About Bitcoin
Just came across ZRX
Bullish traders cast low-risk Ethereum options bets with this clever strategy
Milk Token - AMA Tomorrow - Butter Companion Token this week.
SafeToken on PancakeSwap
NFTs on screen: Mobile games developer Tapinator to launch ‘NFT500’ service
Winners and losers for the last 14 days
Don't forget to buy the $Poodl!!
LOTTO was just listed on WhiteBIT
Cardano Launches Anti-Scam Task Force to fight Fraudsters.
Question about Actinium (ACM) $900,000 MarketCap
Lightning Protocol | Massive Token Burn Event. Long term hold. Quick recap and some News.
Here are my next YOLO: $HOT, $CELR and $TKO I will tell you why...
No BTC - No Worries!! My strategy that 99% of you will think is 100% DEGEN 🤷‍♂️ Tell me that I’m wrong 🎰✌️
Blowfish ($BLOWF) will blow your mind | 70K MC on BSC | Liquidity locked
What's better long term? Mining 3 dollars of BTT a day or mining $2.50 of Bitcoin per day?
