Bonus dans GTA Online: Que vous soyez sur deux ou quatre roues, réalisez 5 cascades pour obtenir un bonus de 500 000 GTA$ sur votre compte Maze Bank dans les sept jours suivants. Ainsi que des récompenses triplées dans Capture d'ozone, des promotions et plus. Jusqu'au 8 avril.
In depth, crash course in DeFi wanted
Do you think while the stock market is in this beat session it would be a good time to temporarily move my investments all into crypto?
Coinbase Q1 revenue jumped nine-fold to about $1.8 billion ahead of company’s public market debut
RTS games?
Coinbase Posts Blowout Q1 Profit of $730-$800 Million Days Before Public Listing
The Bit Short: Inside Crypto’s Doomsday Machine
Gameuses, gameurs, le monde à besoin de vous pour repousser les limites de l'humanité par le gaming 😉 #Windows10
*** Mass Adoption is here***
What are your feelings toward XRP?
Crypto and seriously life changing wealth, thank you guys for helping me get there
Cryptocurrency $2T Market Cap. (We are in this together)
The History of Bitcoin Crashes
How do you stop yourself form buying all the coins?
"I made a Crypto Fantasy League called ""Moonleague""."
My progress after 3 months in Crypto
Ebang: Yet Another Crypto “China Hustle” Absconding With U.S. Investor Cash
My wife made me some crypto-themed shot glasses!
Polkadot-ecosystem platform Polkatrain loses $3 million in a rebate arbitrage attack
Privacy Chat App Signal Rolls Out Cryptocurrency Payments
Spring staking on Binance. Is it worthwhile?
Will EIP-1559 Upgrade Turn Ethereum Into a Deflationary Asset?
Two-time heavyweight champion of the world Tyson Fury launches first boxing NFT
Signal adds cryptocurrency payment option
Trader Michaël van de Poppe Reveals Maximum Price Targets for Bitcoin, Ethereum, Cardano and 5 Other Crypto Assets
Atari creates blockchain division for cryptocurrency, games
FINALLY I can get Dogecoin (I already have some sats) for Coinhunt. AND we can withdraw. AND blue chips are doing great with BTC almost $60000! GOOD DAY!
DavePortnoy.Charity $DPC Meme Coin Just Launched
Merchant Token ICO Going Fast - Phase 25 of 100 now 😱
$LOT - 2 milion marketcap, winner at 0.2% from the total supply. 10+ winners already
$MOONSTAR - 1500 Holders in 48 hours, Website is live, Community is Great, 2 Mil MC
$MoonTrust - Doxxed Devs & Growing Community
FUD vs Future: Your Research, Your Pick
$EvoLion, fk0wned's new token! Really nice play and steadily increasing, ready for liftoff. Only 30 mins old and only x1.8 from pre-sale just yet. Let's GO!
BlowFish MillionaireMakers Launched! Crypto lottery DApp on Binance Smart Chain 💸💸💸
Genesis Shards, combining NFTs and DeFi. Might be the most innovative idea in Crypto.
Here comes $BAG. Watch out!
wCRES. Better alternative for the $60.5 trillions earning next to nothing on bank deposits. 44M Marketcap. Get much higher returns than in a bank on your fiat and crypto. Deposits and returns are fully insured, and your account is non-custodial. Regulated in Switzerland
A prominent coin iv been seeing a lot about. Opinions?
Super Pepe World - Gamified Yield farming and NFT card trading game.
SafeGalaxy vs SafeMoon update, last chance to get in early!
Typhoon Network - $TYPH
🐶 $PIT – Whitebit listing within next week - true 100x-1000x potential
$NICHEMAN [3 days old] [2m market cap]
FAIRSOLAR - Next BSC Gem - Moonshot - Just launched
$CHZ006 - Moonshot - [$785K market cap] - [20 days old] Listings & NFTs!
WenMoon is trending [$2 Million MCAP || 1078 Holders || 91 % Tokens BURNED]
💎$SAFELIGHT >> LIGHTNING FAST 💎
💎 $Thunder the next MOONSHOT (500K MC) 12% Burnrate - Big Ytubers & Twitter acc shills 💎
💎 APRIL GEMS 💎
🙉 Monke - Moon Monkey BSC 🙊 From the Team that Brought You 150x FairOrca
($700k mcap) + Airdrop for Next Game: Reality Clash Coin ($RCC) – Main Game Token of the Reality Games Company Partnered with UK TV Channel BBC for NFT Game (Doctor Who: Worlds Apart) and Merging AR, Mobile and Blockchain Gaming! Is this the next Animoca Brands?
Enter $JDI - Dirt cheap gem that started just few days ago
Bytecoin BCN official announcement:
Waves coin & Waves DEX: Ready for DeFo? - Exodus Wallet
“Unreceived” tokens
Do You Care About Alt Season Ending
[ANN] Crypto Warriors Order - The guild of crypto warriors fighting cybercrime
Does anyone else have this issue on CoinTelegraph? Video links fills in over the article text. Any solutions??
What coins do you think got the most potential in the future?
All-In-One Crypto Trading Platform Atani Adds $6.25M In Seed Capital
iNFT = NFT + AI
MicroStrategy adds to its portfolio another $15 million in Bitcoin - Crypto DeFinance
Help me decide where to stash some found money
Akon’s Crypto Initiative
Cook Protocol Announces Staking Program “Voyage to the New World”
Bullish BTC price analysis on March 29 – April 4 is up to $60k-$65k. ETH may reach the skyrocketing price of $2200 in two weeks. BNB continues to maintain its position beside BTC and ETH.
According to the Fantom Foundation, Afghanistan Railway Authority will now use its technology. Fantom has set out to implement blockchain-based tools to support Afghanistan’s digitization program.
My portfolio this spring TOTHEMOON! - JORDAN!
ALTCOIN?
Atlas.Market - Bitcoin Marketplace using Amazon Wishlists with ~11-20% discount
👻 AaveGotchi GHST joins Global NFT Alliance hosted by Moonswap MOON 👻
What are Stablecoins? How do they Work?
Beware of Changelly.
WazirX exchange is working to restore their network outage. This is due to the heavy load that occurred via their system.
ROUTER FARM 2
Grayscale Plans To Turn Its Bitcoin Trust Into An ETF
MetaMask wallet hacked —- will offer generous reward if crypto is recovered.
guys if you come across these names AKA Martin Sawyer AKA Patrick Martino AKA Robert Baldwin AKA AC Morgan AKA Jordan Meyers AKA Charles Parker AKA Andreas Will on comments on youtube channel or any forum .. PLEASE DO NOT APPROACH THEM.. they are scammers PERSPECTIVE
JCrypTool 1.0.4 released
Can you reverse AND + XOR?
Discussion about a decentralised and distributed accurate timing system.
Anonymous Credentials [State-of-the-art]
A history of how cryptography and cryptanalysis developed over time! Secret Codes: A History of Cryptography (Part 1)
any symmetric crypt function that doesn't error out on failed decrypt?
Is compression still important for file encryption?
Textbook RSA attack using many ciphertexts knowing only e, and the bit-length of p, q
"age (formerly pronounced as Japanese あ げ ""a-geh"" [v. to rise up]) will now be pronounced age (length of survival [age like milk])"
OneDrive or Bitwarden for secure documents
This subreddit is now an NSA fanclub
Inversing Modular Exponentiation
What's the best crypto settings for GPG?
Idea for testing cipher
Book recommendations - mathematical cryptography for cryptocurrencies and blockchains
Symmetric encryption of large file, API decision
Recovering a full PEM Private Key when half of it is redacted
TLS 1.0, 1.1 officially deprecated
certificate transparency log
Password Storage - OWASP Cheat Sheet Series
Why is twin ElGamal CCA secure under CDH assumption?
Career/college path
Any standard for a digital communication security protocol which does not use any asymmetric primitives but 'modern' security?
A Multiplatform Parallel Approach for Lattice Sieving Algorithms
How does PGP work compared to BTC sig address?
Dropbox Vault, how secure is it?
AES Encrypting the same file with the same Key/IV
Bitlocker with Plausible Deniability
Signal protocol security of messages
Understanding Extended-Nonce Constructions (by studying XChaCha)
Starting out with a healthy amount of math knowledge
[meetup] Understanding the TFHE homomorphic encryption scheme
How do zk-SNArKs work?
new in developing, where to start?
Intel to Build Silicon for Fully Homomorphic Encryption: This is Important
Imagine un monde dans lequel les nombreuses aptitudes des gamers seraient recherchées… et partagées avec le plus grand nombre pour repousser les limites de l'humanité par le gaming. #Windows10
Help me break this!
"Is there a non-pairings-based and/or practical implementation for IBE or ""delegatable decryption""?"
Is an AES key just a number?
How will Quantum computing affect Cryptography?
Book suggestion for a noob person in cryptography
"Ruffing: From the abstract on ePrint (not in the paper): ""This destroyes [sic] the RSA cryptosystem."""
Looking for a breakdown of jobs involving cryptanalysis
Rogaway abandoned patents on OCB3
Limitations of hashcat type approach to cracking
Are there any more assymetric key algorithms?
Adventures with RSA Blind Signing
Cryptography Interface Design is a Security Concern
Argon2id question - how does it split between argon2d and argon2i
"Are ChaCha and Salsa20 considered ""deterministic"""
SpaceX does not plan to add ‘tiered pricing’ for Starlink satellite internet service, president says
How to pick the right trading style for you
ChargePoint Alternative Play
Daily Advice Thread - All basic help or advice questions must be posted here.
Real estate is dangerous, change my mind.
If elevated valuations kept you out of the market, you might've missed out on some of the greatest market returns in history.
Energy Transfer ($ET) DD from discord that I wrote.
Daily General Discussion and spitballin thread - April 04, 2021
Daily General Discussion and spitballin thread - April 03, 2021
Gray Television plans to buy Doraville's Assembly, create film and entertainment hub
Which financial modeling program is actually used by top investment banks?
ECB Balance Sheet increased by over €300 Billion in one Week
Affrontez le monde viking de Kaldheim. Découvrez l'extension sur MTG Arena.
ChargePoint (CHPT) Due Diligence
Daily General Discussion and spitballin thread - April 01, 2021
Manage databases, deploy web apps, and analyse datasets with Azure. What will you build?
My take on Gold's longterm outlook
FTC files suit against Illumina (ILMN) to block vertical integration with Grail
Might be a good time to short the Japanese stock market. It isn’t news yet, but another state of emergency looks likely in April
PayPal to allow Americans to pay with Bitcoin, Ethereum at millions of vendors
ARK Space Exploration ETF (ARKX) - Holdings Reveal
Daily General Discussion and spitballin thread - March 30, 2021
Catalysts for novavax stock price
Track your investment portfolio online automatically with Sharesight. Don't waste time manually adding your holdings, trades & dividends into a spreadsheet - sign up FREE and use the award-winning portfolio tracker today.
Stock Scraper Trending Data as of 03/29/21
Ahchegos Capital Management
Largest venture rounds in AQSE?
BREAKING: NeuroRX (BRPA) Announces Successful Phase 3 COVID Drug Trial Results
Failure of the fund to meet margin commitments, Credit Suisse and a number of other banks are in the process of exiting positions
Finding financial numbers by country or geographic location.
Thinking about getting out of BND and picking up series I bonds.
Investing in Helium - DMEHF DD
Coursera: A DD Introduction
Daily General Discussion and spitballin thread - March 28, 2021
Palantir Technologies (PLTR) DD
Bonds vs Stocks and Short Term Returns: Now is not the Time to Panic
Wework announces merger with BowX to go public
Plugging In: The EV Transition Gains Speed
Daily General Discussion and spitballin thread - March 27, 2021
Canadian Index ETFs XIU - XIC - VCN - ZCN comparison
VIAC oversold. Comparison inside.
How to see the % change from a bar when viewing the Tradingview layout?
this id number has already been used
Someone from binance tech support...
new here but yikes!
How long will Stellar XLM network be suspended on Binance?
BNB is mooning again. How high can it go in the next 5 years?
BEP20 address
How to search for coins on binance
PoS staking
Order book history via API?
Moving to India
Fairly new just need a tiny bit of help
frontier
Question regarding an open position in Futures
Does anyone know how to....
Withdrawals have been temporarily suspended due to risk control
transfer -BNB
Buying crypto on Binance using credit card
Help understanding the ICO
I want to withdraw FIAT but binance has blocked it stating 'due to risk control'..what to do ??
How does tax work with crypto Debit cards?
Money gone out of my bank account yet still no shares in the crypto
I guess I get to join the fun.
CANNOT WITHDRAW CRYPTO TRIED EVERYTHING.
margin transfer confusion
Withdrawal from Binance to Newton
I can’t withdraw to debit card
The best alternative for binance...
How long will be under maintenance?
Holdings Chart Possiblity
How do I get through to support?
Why only +0.004x leverage available?
Problem receiving BNB smart chain
Does the binance API allow fiat withdrawals?
Get The Most Advanced Charting Software For Crypto FREE Only For Today. Create custom workspaces, and chart across over 75 exchanges.
(Noob question) why is my balance worth less than the money i just deposited in my wallet?
WITHDRAW SUSPENDED every single time I use the API
8.5k Stuck on binance // Trading disabled -- please upvote so I can get this resolved ....
Why did my $7k get sent to a random ETH address? :(
O3 Wallet now supports BSC
I've accidentally closed the trade history on my binance web. How to put it back?
I can't deposit BNB into Card. ETH works.
Can't access my account and getting nowhere with support (2FA issue)
Please resolve case 589287
XLM still not deposited into account
Can the BNB amount putting on trade pending or staking be counted into average BNB holding in order to participate in Launpad projects ?
Been waiting over 3 weeks for address verification? Support tickets are just kicked back. Why does this process take so long?
Binance fees
Deposted HOT Token yesterday until now nothign shows up in Binance
Blocknative now supports BSC with its Mempool API/SDK and Mempool Explorer — and it automatically decodes Pancake Swap Contracts.
How Binance’s untrustworthy security system failed where all other platforms excelled.
How to survive?
Hey Reddit, build your next great app with 25+ always-free Azure services. What will you create?
XLM! Anyone have this issue or is it just me?
Binance withdrawal suspension / id verification/selfie/video appeal ready / cannot even withdraw fiat
Alien Worlds, a guide to the airdrop via Launchpool
Fund sent to Binance Hot Wallet
Can't withdraw or trade my $70k for over 2 months for no reason
Liquifi
Internal transfer
Symbol equity value
Recovery of deleted account
Is it possible to make 2 seperate portfolios/wallets on 1 account?
Binance referral code
Someone played with my money, no support from Binance!
FRX
Transferring ETHEREUM to Trust wallet
Help with lost funds
Any idea what this is? It randomly showed up on my bscscan but don’t see it in my trust wallet?????
The Nexo Exchange makes buying and selling crypto and fiat fast, simple, and secure. Swap your crypto instantly, with unlimited transactions and 100+ crypto and fiat pairs. Start Exchanging!
Why does Binance.US freeze accounts?
My Binance Visa Card has a different card number than the one on my dashboard
Forgot Memo in Transfer from Trust Wallet to Binance.US
Binance Launchpad: The Tokocrypto (TKO) Token Distribution
BNB leads global passive income assets!
I deposited £1000 over an hour ago it doesn’t usually take this long?
Need help with my first trade.
Referral code
Imagine un monde dans lequel les nombreuses aptitudes des gamers seraient recherchées… et partagées avec les générations futures pour repousser les limites de l'humanité par le gaming. #Windows10
Tokocrypto listing
I can't withdrawl anything on my account
Accidentally sent TRX from Binance to Binance.us
looking for a certain type of order
Losing a lot of money when converting in binance (life?)
Why the hell won't Binance.US let me deposit Cardano?
Another BinanceUS Support Compliant
What Are The Risks Of TLM Staking?
Earn up to 8% APY on your BNB. Passive income through compounding interest, paid daily - Start earning interest now!
Cardano deposit stuck on pending since 3 AM (6 hours)
Is this exchange legit backed by binance? If so then its like security for binance. If binance gets shutdown, this can run the smart chain and binance listings
Is this exchange legit backed by binance? If so then its like security for binance
CAN YOU DRAW LINES ON BINANCE SMARTPHONE APP ? IF YES, HOW ?
The TKO launch tokens will be distributed at 11:00 UCT, but when will trading start?
BINANCE HELP: Case ID #5230364
Struggling with setting Stop Losses while trading
Binance charts do not update real time
ASI is the Next Level of DeFi. Artificial Super Intelligence For Smarter Token Rewards.
PLEASE HELP!!!
Stop locking me out of my account please!
Auto-Convert in binance ?
API QUESTION: Is there a way to place a market order and retrieve the price before?
export address data from BSCAN into Excel
Binance.US token withdraw still pending after 5 days
Claiming VTHO distribution on Binance?
From wallet to trade balance
Help
day limit
Withdrawal still processing
[ATTENTION] - Binance Support!
Can’t withdraw NANO
Binance funds issues as US Resident
what's going on with XRP?
Cannot withdraw fiat from binance to bank account, keeps saying failed when I go to transaction history?
BSC fees getting a bit high for farming
$THUNDER Then next moonshot (500k MC) +800 holders | 12% Burnrate
BULLFARM.FINANCE: A true Deflationary Rebase Protocol. BONUS 11,11% NOW🚀
Deposit of over 500 euros on thursday last week.. Still nothing in my binance funds.
Account trading / withdraw locked for months
USD withdraw in limbo?
Tutorial Help PLEASE
TOKO 🚀 Binance
Binance Emails
Terra hodlers
Please vote to get this awesome project onto BSC!! 🙏🏻
How to see limit orders in the chart via Original Chart (not tradingview)
Binance.us
HELP! I have closed the graphics tabs, orders, etc. How can I get them black?
Binance not Returning my Funds as Agreed
WebDollar cripto
Question about the TKO launch that no-one seems to be answering
When transfering between binance users the other person can see your email, name and address?
Buy The Dip With The Help Of Fibonacci Retracements.
Verification
Binance's sell base limit
3.5+ Billion RVNs on One Account, Rumored to be of Binance's
Futures manipulated
Market Data API - Futures - 404?
binance identity verification failed
Withdrawal / Despot Fees Currency ...
I have one question for you: DID YOU LIKE THE VIDEO GAME DOOM? DOOMGUY.FINANCE $DOOM Is gonna make you reminisce, laugh, and probably make you 100x
Goldman Sachs CEO: ‘Big Evolution’ Is Coming to Bitcoin Regulation
MoonToken - Full Audit in progress, CEX incoming, AMA in 24h, over 2200 holders, very low MC
$LAI - Laika was in orbit and will also be the dog on the moon 🚀🌜🐕
Shill me your coins!
Celer (CELR), Cartesi (CTSI) and Compound (COMP) rally as DeFi heats up
🚀 🌙 Have you heard of $PIT? It's still early to get in on this gem! Not financial advice, make sure to DYOR! 🌙 🚀
New coin for trading options on the ethereum network. Just the beginning. Options.Market is a protocol layer for creating, trading, and redeeming fully-collateralized options contracts for any ERC20 token. Available on uniswap $OSM. 🔥 $300 trillion market 🔥
Adoption Over Hype - TONE
Real-world data comes to NFTs as street artists geotag their work
NFT tickets will revolutionize the ticketing industry - a bullish case for GET protocol
Lightning Protocol - The First Big Incubator/Launchpad for BSC!
MELLO Smart Contract TECHRATE Audit Passed! 🟡™
BlowFish MillionaireMakers Launched! Crypto lottery DApp 💸💸💸
PooCoin new Buy & Sell Feature is CRAZY! <3
Men's College Basketball Player of the Year Luka Garza Selling NFT
Paxos applies for clearing license with SEC following successful pilot tests
$OCTA - The One that stands out from the crowd.
Hurry up your new limited edition lambo might be very close to you!!
CoinMarketCap removes South Korea crypto exchanges from Bitcoin price tracker
Oracle Token Chainlink Replaces XRP in Grayscale's Strategic Large Cap Fund
Innovative Bioresearch (INNBC)
Swapped shitcoin on Pancakeswap for BNB and received nothing. What happened?
$2.52B in bearish Bitcoin options signal pro traders are hedging their bets
WOW!!! Mods and Admins Just Deleted My Post Calling Out BOTs - They are in on it
Did you miss FEG and SAFEMOON? CYBERMOON is Next Moonshot!
Crypto lobby groups are gaining traction in Washington as the threat of regulatory bottleneck looms
Sending BNB from Atomic Wallet to MetaMask
$DRIP - Earn an easy 60% monthly dividend
Can crypto trading and investing be taught in just one book?
27% of Americans Are Familiar with NFTs: Poll
✅Initial Liquidity Offering on UniCrypt: Bonus 11,11%
Stellar Cryptocurrency Nodes Go Dark for 9 Hours and Counting
Need opinions on decision!!!
Russian lobby group launches new campaign against anti-crypto laws
Crypto News Briefing: XRP to $4? Near Rainbow Bridge? King's Ransom Paid in BTC? & more... - CryptoAndCoffeeLive on Twitch
MOB to be integrated into Signal Messenger (already working in the UK) - millions of users => moon
Just got scammed(fshiba)
$DMDHANDS Token | A crypto that rewards those with DIAMOND HANDS 💎
Are you shopping online and you have a portfolio🧐
SeedSwap ($SNFT) (DeFi/Staking/NFTs) now launching Social Media on platform (seriously undervalued, sub 1m mcap)
Doge to Digi
NFTs are accelerating Topps' digital transition, says chair
Typhoon Network - TYPH
Is Octans ($Octa) a Scam?
Luxury Nashville Hotel Takes Bookings in Bitcoin—or Dogecoin
Thunderbolt⚡️ is Breaking the BSC at the Moment.
Charity Coin- Orfan
Coinbase and Square lead new crypto lobbying effort
Prep time with Bitcoin: Students have fun new ways to study crypto
You got a $WENR? Want to see it grow bigger? Wanna support Testicular Cancer Research? Welcome to the $WENR party!
Hodl Everything
$MEE - Mercurity Finance. NASDAQ company enters DeFi space - 7M mcap
Late night moon shot $EULER
MEMESTOKEN $MEMES - a bright future for fellow memers
Grayscale Adds Chainlink to Its Digital Large Cap Fund
DOV Was Just Listed on WhiteBIT
After breaking $100 billion TVL, DeFi is now the equivalent of a top 40 U.S. bank
What are your top picks from today till Friday?
Anynone bullish on dent?
Bitcoin falls below $58K as Bloomberg eyes $80K BTC price in Q2
How do I get my money out of this shitcoin?
$RAPTR - [100k MC] PhilosoRaptor - Gem in the making!
Mark Cuban-Backed Nifty's Hires NFT Copyright Expert as CLO
Sold 1 billion safemoon for 60 $
Why do we never hear about the Expanse blockchain here? Seems like the project is still going strong with lots of Dev for 2021 and yet not a peep about it.
Meter (MTRG) is actually the moonshot we've all been looking for: $24m market cap, VC investment, awesome partnerships, doxxed team, great whitepaper, great project with awesome utility.
Mining Manufacturer Ebang Launches Cryptocurrency Exchange
Deep look into $SOAR, the next crypto gem
POOCOIN APP has just officially released 'Premium Tier 2' which allows you to track the Buys and Sells on the chart of your or ANY WALLET - game changer. All you need to do is hold $300 of Poo/BNB Liquidity.
ADA - Cardano - Crazy Community
Why does everyone still sleep on eGLD (Elrond)?
Kicking myself for not putting a few hundred dollars into Safemoon when I first heard about it in early March. Would it better to buy some now or put the money into a newer similar cryptocurrency?
Expert analyses Tron (TRX), Zilliqa (ZIL) and BitTorrent (BTT) price for 2021
UNICEF CryptoFund Gets $1 Million in ‘Institutional Bitcoin’ Donation
NSURE underwriting begins tomorrow
$LAMA Hidden GEM – LlamaSwap (LAMA) on BSC! VERY LOW market Cap! 100X or 1000X!
This is $SafeStar
$blink just mooned!! (See my previous posts explaining why)
Multivac(Mtv) potential x100
Moonshot Monday is finished! Vote now in the poll to decide which coin should be crowned the winner! To prevent vote manipulation we are following the same rule as last week, ONLY VOTES FROM MEMBERS OF t.me/SSBannouncements WILL BE COUNTED! You must join the group to prove you are human! Vote now!
MicroStrategy acquires an additional $15 Million in Bitcoin
Grayscale Adds Chainlink To Digital Large Cap Fund (GDLC)
V2 of X-win has launched, new farming concepts yet to be seen on BSC
What happens to your NFTs and crypto assets after you die?
Powertrade Fuel
GTO 87 M market cap witg 240 M volume right now
Credit Suisse Taps Blockchain to Settle Stock Trades in 1.5 Hours
Balancer Ventures Outside Ethereum, Aims to Be Algorand's Uniswap
Buy more Bitcoin, analyst tells institutions as $257M in BTC leaves Gemini
Indian IT giant Tech Mahindra to launch stablecoin tool for banks
Phoenix.finance (PNIX)
A new project that has actually good FA. Cellframe. $CELL 25m MC
EVENT: Token Systems - Webinar Series
BREAKING: Cryptos surge as Fidelity announces new Bitcoin trade group
A Unique Supply Chain Solution Has Been Implemented On Cardano. Could This Challenge VeChain?
The Regulatory Shift
Litecoin Creator Charlie Lee Joins BTCS as New Independent Director
$STC Next big platform for NFTs check it out https://stctoken.us/?ref=Sx7h2sif88
Cardano Venture Fund (cFund) Invests In COTI in Preparation for Smart Contract Implementation
Best ICO in 2021?
All-In-One Crypto Trading Platform Atani Adds $6.25M In Seed Capital - CoinQuora
Binance Coin (BNB) Overtakes $400, Sets New All Time-High - CoinQuora
